[
    {
        "yapilandirilmis_veri": {
            "fatura_no": "ABK2025000000273",
            "fatura_tarihi": "05-05-2025",
            "duzenleme_saati": "14:05:00",
            "ettn": "c55052c6-696b-4251-a1bb-b9a44201f217",
            "mal_hizmet_toplam_tutari": "83.333,33 TL",
            "yazi_ile_tutar": "#Yüz Bin",
            "para_birimi": "TL",
            "senaryo": "TICARIFATURA",
            "fatura_tipi_kod": "SATIS",
            "urun_kalemleri": []
        },
        "ham_metin": "UYUMSOFT BİLGİ SİSTEMLERİ VE TEKNOLOJİLERİ TİCARET\nANONİM ŞİRKETİ\ndeddekorklur mahallesi atakent caddesi\n42000 Zincirlikuyu/ İstanbul\nTel: 9995555566666644\nWeb Sitesi: www.zootopiaglobal.com\nVergi Dairesi: 30 ağustos\nR\nVKN: 9000068418\nTICARETSICILNO: 12345f e-FATURA\nMERSISNO: 2222 e\nd\nÖzelleştirme No: TR1.2\nd\nSenaryo: TICARIFATURA\ne Fatura Tipi: SATIS\nSAYIN\nFatura No: ABK2025000000273\nUyumsoft Bilgi Sistemleri Ve Teknolojileri Ticaret Anonim Şirketi d\nILCE/ İstanbul Fatura Tarihi: 05-05-2025\nVKN: 9000068418 i Düzenleme Tarihi: 05-05-2025\nl Düzenleme Saati: 14:05:00\nd\nETTN: c55052c6-696b-4251-a1bb-b9a44201f217\ni\nSıra İskonto İskonto KDV\nMal Hizmet Miktar Birim Fiyat KDV Tutarı Diğer Vergiler Mal Hizmet Tutarı\nNo Oranı Tutarı Oranı\n1 ürün 1 1 Adet 83.333,33000000 TL %20,00 16.666,67 TL 83.333,33 TL\nMal Hizmet Toplam Tutarı 83.333,33 TL\nToplam İskonto 0,00 TL\nHesaplanan KDV(%20.00) 16.666,67 TL\nVergiler Dahil Toplam Tutar 100.000,00 TL\nÖdenecek Tutar 100.000,00 TL\nYalnız #Yüz Bin Türk Lirası#"
    },
    {
        "yapilandirilmis_veri": {
            "fatura_no": "BTY2024000000589",
            "fatura_tarihi": "03-07-2024",
            "duzenleme_saati": "18:04:52",
            "ettn": "e478dea7-146d-4d2b-a31e-b4d823501b51",
            "siparis_no": "ORD1234567",
            "mal_hizmet_toplam_tutari": "102.880,00 TL",
            "para_birimi": "TL",
            "senaryo": "TICARIFATURA",
            "fatura_tipi_kod": "SATIS",
            "irsaliye_no": "ve",
            "siparis_tarihi": "03-07-2024",
            "satici_unvan": "-111 e-FATURA Özelleştirme No: TR1.2 Senaryo: TICARIFATURA SAYIN Fatura Tipi: SATIS XYZ Company Gmbh. Fatura No: BTY2024000000589 Oberlandstraße 40-41 Fatura Tarihi: 03-07-2024 Esenler/ Berlin Düzenleme Tarihi: 03-07-2024 E-Posta: test@test.com Tel: 0212200022 Fax: 22111222 Düzenleme Saati: 18:04:52 VKN: 9000068418 Sipariş No: ORD1234567 Sipariş Tarihi: 03-07-2024 ETTN: e478dea7-146d-4d2b-a31e-b4d823501b51 Sıra İskonto İskonto KDV Mal Hizmet Miktar Birim Fiyat KDV Tutarı Diğer Vergiler Mal Hizmet Tutarı No Oranı Tutarı Oranı 1 czzxczx 1 Adet102.880,00000000 TL 100,00 TL %20,00 123.456,00 TL 123.456,00 TL Mal Hizmet Toplam Tutarı 102.880,00 TL Toplam İskonto Hesaplanan KDV(%20) 20.576,00 TL Vergiler Dahil Toplam Tutar 123.456,00 TL Ödenecek Tutar 123.456,00 TL İrsaliye No ve Tarihleri : IRS000000001 (03-07-2024) | IRS000000002 (03-07-2024) Fatura Notu Fatura Notu İnternet Sitesi: | Ödeme Tarihi: 03.07.2024 | Ödeme Tipi: KREDIKARTI/BANKAKARTI | Kargo Tarihi: 03.07.2024",
            "alici_vergi_dairesi": "Esenler",
            "urun_kalemleri": []
        },
        "ham_metin": "Uyumsoft Bilgi Sistemleri ve Teknolojileri A.Ş.\nYTÜ Davutpaşa Kampüsü No:401\nEsenler/ İstanbul\nVergi Dairesi: Esenler\nVKN: 9000068418\nMERSISNO: 12345669-111\nTICARETSICILNO: 12345669-111\ne-FATURA\nÖzelleştirme No: TR1.2\nSenaryo: TICARIFATURA\nSAYIN\nFatura Tipi: SATIS\nXYZ Company Gmbh.\nFatura No: BTY2024000000589\nOberlandstraße 40-41\nFatura Tarihi: 03-07-2024\nEsenler/ Berlin\nDüzenleme Tarihi: 03-07-2024\nE-Posta: test@test.com\nTel: 0212200022 Fax: 22111222 Düzenleme Saati: 18:04:52\nVKN: 9000068418 Sipariş No: ORD1234567\nSipariş Tarihi: 03-07-2024\nETTN: e478dea7-146d-4d2b-a31e-b4d823501b51\nSıra İskonto İskonto KDV\nMal Hizmet Miktar Birim Fiyat KDV Tutarı Diğer Vergiler Mal Hizmet Tutarı\nNo Oranı Tutarı Oranı\n1 czzxczx 1 Adet102.880,00000000 TL 100,00 TL %20,00 123.456,00 TL 123.456,00 TL\nMal Hizmet Toplam Tutarı 102.880,00 TL\nToplam İskonto\nHesaplanan KDV(%20) 20.576,00 TL\nVergiler Dahil Toplam Tutar 123.456,00 TL\nÖdenecek Tutar 123.456,00 TL\nİrsaliye No ve Tarihleri : IRS000000001 (03-07-2024) | IRS000000002 (03-07-2024)\nFatura Notu\nFatura Notu\nİnternet Sitesi: | Ödeme Tarihi: 03.07.2024 | Ödeme Tipi: KREDIKARTI/BANKAKARTI | Kargo Tarihi: 03.07.2024"
    },
    {
        "yapilandirilmis_veri": {
            "fatura_no": "MNT2023000000089",
            "fatura_tarihi": "01-04-2023",
            "duzenleme_saati": "18:27:00",
            "ettn": "88e67d12-82bc-429d-a2fe-739c697b0e58",
            "mal_hizmet_toplam_tutari": "38.374,00 TL",
            "para_birimi": "TL",
            "senaryo": "TEMELFATURA",
            "fatura_tipi_kod": "SATIS",
            "satici_unvan": "-111 e-FATURA SAYIN Akkaya Yazılım Özelleştirme No: TR1.2 Yıldız Kapı No:45 Senaryo: TEMELFATURA Kapı No:A3 Fatura Tipi: SATIS Kütahya/ Kütahya Fatura No: MNT2023000000089 E-Posta: bodurum88@hotmail.com Vergi Dairesi: Bodrum Fatura Tarihi: 01-04-2023 VKN: 9000068418 Düzenleme Tarihi: 01-04-2023 Düzenleme Saati: 18:27:00 ETTN: 88e67d12-82bc-429d-a2fe-739c697b0e58 Sıra İskonto İskonto KDV Mal Hizmet Miktar Birim Fiyat KDV Tutarı Diğer Vergiler Mal Hizmet Tutarı No Oranı Tutarı Oranı Chivas Regal 12 Years 100 13 2 Adet 875,00000000 TL %0,00 0,00 TL %18,00 315,00 TL 1.750,00 TL cl Chivas Regal 12 Years 35 14 5 Adet 360,00000000 TL %0,00 0,00 TL %18,00 324,00 TL 1.800,00 TL cl Mal Hizmet Toplam Tutarı 38.374,00 TL Toplam İskonto 0,00 TL Hesaplanan KDV(%18) 14.453,64 TL Vergiler Dahil Toplam Tutar 45.281,32 TL Ödenecek Tutar 45.281,32 TL havale Not 2 Yalnız # KIRK BEŞ BİN İKİ YÜZ SEKSEN BİR Lira OTUZ İKİ Kuruş #",
            "alici_vergi_dairesi": "Bodrum",
            "urun_kalemleri": []
        },
        "ham_metin": "Beşler Market Gümbet Paket\nAdnan Menderes No:29\nBodrum/ Muğla\nVergi Dairesi: Bodrum\nVKN: 9000068418\nMERSISNO: 12345669-111\nTICARETSICILNO: 12345669-111\ne-FATURA\nSAYIN\nAkkaya Yazılım Özelleştirme No: TR1.2\nYıldız Kapı No:45 Senaryo: TEMELFATURA\nKapı No:A3\nFatura Tipi: SATIS\nKütahya/ Kütahya\nFatura No: MNT2023000000089\nE-Posta: bodurum88@hotmail.com\nVergi Dairesi: Bodrum Fatura Tarihi: 01-04-2023\nVKN: 9000068418 Düzenleme Tarihi: 01-04-2023\nDüzenleme Saati: 18:27:00\nETTN: 88e67d12-82bc-429d-a2fe-739c697b0e58\nSıra İskonto İskonto KDV\nMal Hizmet Miktar Birim Fiyat KDV Tutarı Diğer Vergiler Mal Hizmet Tutarı\nNo Oranı Tutarı Oranı\nChivas Regal 12 Years 100\n13 2 Adet 875,00000000 TL %0,00 0,00 TL %18,00 315,00 TL 1.750,00 TL\ncl\nChivas Regal 12 Years 35\n14 5 Adet 360,00000000 TL %0,00 0,00 TL %18,00 324,00 TL 1.800,00 TL\ncl\nMal Hizmet Toplam Tutarı 38.374,00 TL\nToplam İskonto 0,00 TL\nHesaplanan KDV(%18) 14.453,64 TL\nVergiler Dahil Toplam Tutar 45.281,32 TL\nÖdenecek Tutar 45.281,32 TL\nhavale\nNot 2\nYalnız # KIRK BEŞ BİN İKİ YÜZ SEKSEN BİR Lira OTUZ İKİ Kuruş #"
    },
    {
        "yapilandirilmis_veri": {
            "fatura_no": "NYS2025000000186",
            "fatura_tarihi": "05-07-2025",
            "duzenleme_saati": "14:41:20",
            "ettn": "afb7d4fe-7e43-40f6-b9f7-c8f725e7f051",
            "siparis_no": "354",
            "mal_hizmet_toplam_tutari": "85.780,00 TL",
            "para_birimi": "TL",
            "senaryo": "TICARIFATURA",
            "fatura_tipi_kod": "SATIS",
            "siparis_tarihi": "05-07-2025",
            "alici_vergi_dairesi": "Büyükçekmece",
            "urun_kalemleri": []
        },
        "ham_metin": "GANİMET BİLİŞİM ELEKTRİK ELEKTRONİK BİLGİSAYAR TEKNİK\nDESTEK VE DANIŞMANLIK HİZM.SAN.TİC.LTD.ŞTİ.\nFerhatpaşa Mah. Atatürk Cad. No:61 Çatalca İstanbul\nVergi Dairesi: Büyükçekmece VD.\nVKN: 9000068418\ne-FATURA\nÖzelleştirme No: TR1.2\nSenaryo: TICARIFATURA\nFatura Tipi: SATIS\nFatura No: NYS2025000000186\nFatura Tarihi: 05-07-2025\nSAYIN\nDüzenleme Tarihi: 05-07-2025\nUyumsoft Test Firma\nTürkiye Düzenleme Saati: 14:41:20\nVKN: 9000068418 Sipariş No: 354\nSipariş Tarihi: 05-07-2025\nETTN: afb7d4fe-7e43-40f6-b9f7-c8f725e7f051\nSıra İskonto İskonto KDV\nMal Hizmet Miktar Birim Fiyat KDV Tutarı Diğer Vergiler Mal Hizmet Tutarı\nNo Oranı Tutarı Oranı\nBİLGİSAYAR KASASI ( İ5-\n13400F, 16GB DDR4 RAM\n1 , 500GB SSD, 2GB EKRAN 4 Adet 20.000,00000000 TL %20,00 16.000,00 TL 80.000,00 TL\nKARTI ,400W POWER\nKASA ÖZELLİKLERİNDE)\n24 ASUS VZ24EHF IPS FHD\n2 1 Adet 5.780,00000000 TL %20,00 1.156,00 TL 5.780,00 TL\n100MZ 1MS HDMI\nMal Hizmet Toplam Tutarı 85.780,00 TL\nToplam İskonto 0,00 TL\nHesaplanan KDV(%20) 17.156,00 TL\nVergiler Dahil Toplam Tutar 102.936,00 TL\nÖdenecek Tutar 102.936,00 TL\nE Fatura Not Kısmı\n#Yüz İki Bin Dokuz Yüz Otuz Altı Türk Lirası #"
    },
    {
        "yapilandirilmis_veri": {
            "fatura_no": "NYS2025000000185",
            "fatura_tarihi": "05-07-2025",
            "duzenleme_saati": "14:39:03",
            "ettn": "28b2ad6f-86c6-423c-ad57-a9169889b731",
            "siparis_no": "354",
            "mal_hizmet_toplam_tutari": "85.780,00 TL",
            "para_birimi": "TL",
            "senaryo": "TICARIFATURA",
            "fatura_tipi_kod": "SATIS",
            "siparis_tarihi": "03-07-2025",
            "alici_vergi_dairesi": "Büyükçekmece",
            "urun_kalemleri": []
        },
        "ham_metin": "GANİMET BİLİŞİM ELEKTRİK ELEKTRONİK BİLGİSAYAR TEKNİK\nDESTEK VE DANIŞMANLIK HİZM.SAN.TİC.LTD.ŞTİ.\nFerhatpaşa Mah. Atatürk Cad. No:61 Çatalca İstanbul\nVergi Dairesi: Büyükçekmece VD.\nVKN: 9000068418\ne-FATURA\nÖzelleştirme No: TR1.2\nSenaryo: TICARIFATURA\nFatura Tipi: SATIS\nFatura No: NYS2025000000185\nFatura Tarihi: 05-07-2025\nSAYIN\nDüzenleme Tarihi: 05-07-2025\nUyumsoft Test Firma\nTürkiye Düzenleme Saati: 14:39:03\nVKN: 9000068418 Sipariş No: 354\nSipariş Tarihi: 03-07-2025\nETTN: 28b2ad6f-86c6-423c-ad57-a9169889b731\nSıra İskonto İskonto KDV\nMal Hizmet Miktar Birim Fiyat KDV Tutarı Diğer Vergiler Mal Hizmet Tutarı\nNo Oranı Tutarı Oranı\nBİLGİSAYAR KASASI ( İ5-\n13400F, 16GB DDR4 RAM\n1 , 500GB SSD, 2GB EKRAN 4 Adet 20.000,00000000 TL %20,00 16.000,00 TL 80.000,00 TL\nKARTI ,400W POWER\nKASA ÖZELLİKLERİNDE)\n24 ASUS VZ24EHF IPS FHD\n2 1 Adet 5.780,00000000 TL %20,00 1.156,00 TL 5.780,00 TL\n100MZ 1MS HDMI\nMal Hizmet Toplam Tutarı 85.780,00 TL\nToplam İskonto 0,00 TL\nHesaplanan KDV(%20) 17.156,00 TL\nVergiler Dahil Toplam Tutar 102.936,00 TL\nÖdenecek Tutar 102.936,00 TL\nE Fatura Not Kısmı\n#Yüz İki Bin Dokuz Yüz Otuz Altı Türk Lirası #"
    },
    {
        "yapilandirilmis_veri": {
            "fatura_no": "OGZ2025000000005",
            "fatura_tarihi": "09-05-2025",
            "duzenleme_saati": "01:08:00",
            "ettn": "d8243407-911e-4593-8a0d-e808dd80b9cf",
            "mal_hizmet_toplam_tutari": "136.363,64 TL",
            "yazi_ile_tutar": "#Yüz Elli Bin",
            "para_birimi": "TL",
            "senaryo": "TICARIFATURA",
            "fatura_tipi_kod": "SATIS",
            "alici_vergi_dairesi": "ESENLER",
            "urun_kalemleri": []
        },
        "ham_metin": "UYUMSOFT BİLGİ SİSTEMLERİ VE TEKNOLOJİLERİ TİCARET\nANONİM ŞİRKETİ\ndeddekorklur mahallesi atakent caddesi\n42000 Zincirlikuyu/ İstanbul\nTel: 9995555566666644\nWeb Sitesi: www.zootopiaglobal.com\nVergi Dairesi: 30 ağustos\nVKN: 9000068418\nTICARETSICILNO: 12345f e-FATURA\nMERSISNO: 2222\nSAYIN\nUYUMSOFT BİLGİ SİSTEMLERİ VE TEKNOLOJİLERİ TİCARET\nANONİM ŞİRKETİ Özelleştirme No: TR1.2\nESKİ LONDRA ASFALTI CAD. KULUÇKA MRK. A1 BLOK No:151 Senaryo: TICARIFATURA\n/1C\nFatura Tipi: SATIS\nKapı No:201\nFatura No: OGZ2025000000005\nESENLER/ İSTANBUL\nVergi Dairesi: ESENLER VERGİ DAİRESİ MÜD. Fatura Tarihi: 09-05-2025\nVKN: 9000068418 Düzenleme Tarihi: 09-05-2025\nDüzenleme Saati: 01:08:00\nETTN: d8243407-911e-4593-8a0d-e808dd80b9cf\nSıra İskonto İskonto KDV\nMal Hizmet Miktar Birim Fiyat KDV Tutarı Diğer Vergiler Mal Hizmet Tutarı\nNo Oranı Tutarı Oranı\n1 fuyjvh 1 Adet136.363,64000000 TL %10,00 13.636,36 TL 136.363,64 TL\nMal Hizmet Toplam Tutarı 136.363,64 TL\nToplam İskonto 0,00 TL\nHesaplanan KDV(%10.00) 13.636,36 TL\nVergiler Dahil Toplam Tutar 150.000,00 TL\nÖdenecek Tutar 150.000,00 TL\nYalnız #Yüz Elli Bin Türk Lirası#"
    },
    {
        "yapilandirilmis_veri": {
            "fatura_no": "NYS2025000000187",
            "fatura_tarihi": "05-07-2025",
            "duzenleme_saati": "14:49:43",
            "ettn": "5ec787ee-fec8-4274-b45f-cc6b7f9fd66d",
            "siparis_no": "354",
            "mal_hizmet_toplam_tutari": "85.780,00 TL",
            "para_birimi": "TL",
            "senaryo": "TICARIFATURA",
            "fatura_tipi_kod": "SATIS",
            "siparis_tarihi": "03-07-2025",
            "alici_vergi_dairesi": "Büyükçekmece",
            "urun_kalemleri": []
        },
        "ham_metin": "GANİMET BİLİŞİM ELEKTRİK ELEKTRONİK BİLGİSAYAR TEKNİK\nDESTEK VE DANIŞMANLIK HİZM.SAN.TİC.LTD.ŞTİ.\nFerhatpaşa Mah. Atatürk Cad. No:61 Çatalca İstanbul\nVergi Dairesi: Büyükçekmece VD.\nVKN: 9000068418\nR\ne-FATURA\ne Özelleştirme No: TR1.2\nSenaryo: TICARIFATURA\nd\nFatura Tipi: SATIS\nd Fatura No: NYS2025000000187\nFatura Tarihi: 05-07-2025\nSAYIN e\nDüzenleme Tarihi: 05-07-2025\nUyumsoft Test Firma\nTürkiye d Düzenleme Saati: 14:49:43\nVKN: 9000068418 i Sipariş No: 354\nSipariş Tarihi: 03-07-2025\nl\nETTN: 5ec787ee-fec8-4274-b45f-cc6b7f9fd66d d\nSıra İskonto İiskonto KDV\nMal Hizmet Miktar Birim Fiyat KDV Tutarı Diğer Vergiler Mal Hizmet Tutarı\nNo Oranı Tutarı Oranı\nBİLGİSAYAR KASASI ( İ5-\n13400F, 16GB DDR4 RAM\n1 , 500GB SSD, 2GB EKRAN 4 Adet 20.000,00000000 TL %20,00 16.000,00 TL 80.000,00 TL\nKARTI ,400W POWER\nKASA ÖZELLİKLERİNDE)\n24 ASUS VZ24EHF IPS FHD\n2 1 Adet 5.780,00000000 TL %20,00 1.156,00 TL 5.780,00 TL\n100MZ 1MS HDMI\nMal Hizmet Toplam Tutarı 85.780,00 TL\nToplam İskonto 0,00 TL\nHesaplanan KDV(%20) 17.156,00 TL\nVergiler Dahil Toplam Tutar 102.936,00 TL\nÖdenecek Tutar 102.936,00 TL\nE Fatura Not Kısmı\n#Yüz İki Bin Dokuz Yüz Otuz Altı Türk Lirası #"
    },
    {
        "yapilandirilmis_veri": {
            "fatura_no": "MNT2023000000088",
            "fatura_tarihi": "01-04-2023",
            "duzenleme_saati": "18:27:00",
            "ettn": "cd6a6a13-83f1-45fd-8f58-1ac0eb358826",
            "mal_hizmet_toplam_tutari": "38.374,00 TL",
            "para_birimi": "TL",
            "senaryo": "TEMELFATURA",
            "fatura_tipi_kod": "SATIS",
            "satici_unvan": "-111 e-FATURA SAYIN Akkaya Yazılım Özelleştirme No: TR1.2 Yıldız Kapı No:45 Senaryo: TEMELFATURA Kapı No:A3 Fatura Tipi: SATIS Kütahya/ Kütahya Fatura No: MNT2023000000088 E-Posta: bodurum88@hotmail.com Vergi Dairesi: Bodrum Fatura Tarihi: 01-04-2023 VKN: 9000068418 Düzenleme Tarihi: 01-04-2023 Düzenleme Saati: 18:27:00 ETTN: cd6a6a13-83f1-45fd-8f58-1ac0eb358826 Sıra İskonto İskonto KDV Mal Hizmet Miktar Birim Fiyat KDV Tutarı Diğer Vergiler Mal Hizmet Tutarı No Oranı Tutarı Oranı Chivas Regal 12 Years 100 7 2 Adet 875,00000000 TL %0,00 0,00 TL %18,00 315,00 TL 1.750,00 TL cl Chivas Regal 12 Years 35 8 5 Adet 360,00000000 TL %0,00 0,00 TL %18,00 324,00 TL 1.800,00 TL cl 9 Chivas Regal 12 Years 3L 10 Adet 3.200,00000000 TL %0,00 0,00 TL %18,00 5.760,00 TL 32.000,00 TL 10 Chivas Regal 12 Years 50cl 1 Adet 475,00000000 TL %0,00 0,00 TL %18,00 85,50 TL 475,00 TL Chivas Regal 13 Years 11 1 Adet 699,00000000 TL %0,00 0,00 TL %18,00 125,82 TL 699,00 TL extra 12 Chivas Regal 18 Years 70cl 1 Adet 1.650,00000000 TL %0,00 0,00 TL %18,00 297,00 TL 1.650,00 TL Mal Hizmet Toplam Tutarı 38.374,00 TL Toplam İskonto 0,00 TL Hesaplanan KDV(%18) 13.814,64 TL Vergiler Dahil Toplam Tutar 45.281,32 TL Ödenecek Tutar 45.281,32 TL Not 2 Yalnız # KIRK BEŞ BİN İKİ YÜZ SEKSEN BİR Lira OTUZ İKİ Kuruş #",
            "alici_vergi_dairesi": "Bodrum",
            "urun_kalemleri": []
        },
        "ham_metin": "Beşler Market Gümbet Paket\nAdnan Menderes No:29\nBodrum/ Muğla\nVergi Dairesi: Bodrum\nVKN: 9000068418\nMERSISNO: 12345669-111\nTICARETSICILNO: 12345669-111\ne-FATURA\nSAYIN\nAkkaya Yazılım Özelleştirme No: TR1.2\nYıldız Kapı No:45 Senaryo: TEMELFATURA\nKapı No:A3\nFatura Tipi: SATIS\nKütahya/ Kütahya\nFatura No: MNT2023000000088\nE-Posta: bodurum88@hotmail.com\nVergi Dairesi: Bodrum Fatura Tarihi: 01-04-2023\nVKN: 9000068418 Düzenleme Tarihi: 01-04-2023\nDüzenleme Saati: 18:27:00\nETTN: cd6a6a13-83f1-45fd-8f58-1ac0eb358826\nSıra İskonto İskonto KDV\nMal Hizmet Miktar Birim Fiyat KDV Tutarı Diğer Vergiler Mal Hizmet Tutarı\nNo Oranı Tutarı Oranı\nChivas Regal 12 Years 100\n7 2 Adet 875,00000000 TL %0,00 0,00 TL %18,00 315,00 TL 1.750,00 TL\ncl\nChivas Regal 12 Years 35\n8 5 Adet 360,00000000 TL %0,00 0,00 TL %18,00 324,00 TL 1.800,00 TL\ncl\n9 Chivas Regal 12 Years 3L 10 Adet 3.200,00000000 TL %0,00 0,00 TL %18,00 5.760,00 TL 32.000,00 TL\n10 Chivas Regal 12 Years 50cl 1 Adet 475,00000000 TL %0,00 0,00 TL %18,00 85,50 TL 475,00 TL\nChivas Regal 13 Years\n11 1 Adet 699,00000000 TL %0,00 0,00 TL %18,00 125,82 TL 699,00 TL\nextra\n12 Chivas Regal 18 Years 70cl 1 Adet 1.650,00000000 TL %0,00 0,00 TL %18,00 297,00 TL 1.650,00 TL\nMal Hizmet Toplam Tutarı 38.374,00 TL\nToplam İskonto 0,00 TL\nHesaplanan KDV(%18) 13.814,64 TL\nVergiler Dahil Toplam Tutar 45.281,32 TL\nÖdenecek Tutar 45.281,32 TL\nNot 2\nYalnız # KIRK BEŞ BİN İKİ YÜZ SEKSEN BİR Lira OTUZ İKİ Kuruş #"
    },
    {
        "yapilandirilmis_veri": {
            "fatura_no": "NYS2025000000188",
            "fatura_tarihi": "05-07-2025",
            "duzenleme_saati": "14:50:22",
            "ettn": "5e41e775-2f7e-4f80-9322-e1b9ad15ebd8",
            "siparis_no": "354",
            "mal_hizmet_toplam_tutari": "85.780,00 TL",
            "para_birimi": "TL",
            "senaryo": "TICARIFATURA",
            "fatura_tipi_kod": "SATIS",
            "siparis_tarihi": "03-07-2025",
            "alici_vergi_dairesi": "Büyükçekmece",
            "urun_kalemleri": []
        },
        "ham_metin": "GANİMET BİLİŞİM ELEKTRİK ELEKTRONİK BİLGİSAYAR TEKNİK\nDESTEK VE DANIŞMANLIK HİZM.SAN.TİC.LTD.ŞTİ.\nFerhatpaşa Mah. Atatürk Cad. No:61 Çatalca İstanbul\nVergi Dairesi: Büyükçekmece VD.\nVKN: 9000068418\nR\ne-FATURA\ne Özelleştirme No: TR1.2\nSenaryo: TICARIFATURA\nd\nFatura Tipi: SATIS\nd Fatura No: NYS2025000000188\nFatura Tarihi: 05-07-2025\nSAYIN e\nDüzenleme Tarihi: 05-07-2025\nUyumsoft Test Firma\nTürkiye d Düzenleme Saati: 14:50:22\nVKN: 9000068418 i Sipariş No: 354\nSipariş Tarihi: 03-07-2025\nl\nETTN: 5e41e775-2f7e-4f80-9322-e1b9ad15ebd8 d\nSıra İskonto İiskonto KDV\nMal Hizmet Miktar Birim Fiyat KDV Tutarı Diğer Vergiler Mal Hizmet Tutarı\nNo Oranı Tutarı Oranı\nBİLGİSAYAR KASASI ( İ5-\n13400F, 16GB DDR4 RAM\n1 , 500GB SSD, 2GB EKRAN 4 Adet 20.000,00000000 TL %20,00 16.000,00 TL 80.000,00 TL\nKARTI ,400W POWER\nKASA ÖZELLİKLERİNDE)\n24 ASUS VZ24EHF IPS FHD\n2 1 Adet 5.780,00000000 TL %20,00 1.156,00 TL 5.780,00 TL\n100MZ 1MS HDMI\nMal Hizmet Toplam Tutarı 85.780,00 TL\nToplam İskonto 0,00 TL\nHesaplanan KDV(%20) 17.156,00 TL\nVergiler Dahil Toplam Tutar 102.936,00 TL\nÖdenecek Tutar 102.936,00 TL\nE Fatura Not Kısmı\n#Yüz İki Bin Dokuz Yüz Otuz Altı Türk Lirası #"
    },
    {
        "yapilandirilmis_veri": {
            "fatura_no": "NYS2025000000189",
            "fatura_tarihi": "05-07-2025",
            "duzenleme_saati": "14:54:10",
            "ettn": "d362a8e9-26e3-449c-9495-4da7d1b20d81",
            "siparis_no": "354",
            "mal_hizmet_toplam_tutari": "85.780,00 TL",
            "para_birimi": "TL",
            "senaryo": "TICARIFATURA",
            "fatura_tipi_kod": "SATIS",
            "siparis_tarihi": "03-07-2025",
            "alici_vergi_dairesi": "Büyükçekmece",
            "urun_kalemleri": []
        },
        "ham_metin": "GANİMET BİLİŞİM ELEKTRİK ELEKTRONİK BİLGİSAYAR TEKNİK\nDESTEK VE DANIŞMANLIK HİZM.SAN.TİC.LTD.ŞTİ.\nFerhatpaşa Mah. Atatürk Cad. No:61 Çatalca İstanbul\nVergi Dairesi: Büyükçekmece VD.\nVKN: 9000068418\ne-FATURA\nÖzelleştirme No: TR1.2\nSenaryo: TICARIFATURA\nFatura Tipi: SATIS\nFatura No: NYS2025000000189\nFatura Tarihi: 05-07-2025\nSAYIN\nDüzenleme Tarihi: 05-07-2025\nUyumsoft Test Firma\nTürkiye Düzenleme Saati: 14:54:10\nVKN: 9000068418 Sipariş No: 354\nSipariş Tarihi: 03-07-2025\nETTN: d362a8e9-26e3-449c-9495-4da7d1b20d81\nSıra İskonto İskonto KDV\nMal Hizmet Miktar Birim Fiyat KDV Tutarı Diğer Vergiler Mal Hizmet Tutarı\nNo Oranı Tutarı Oranı\nBİLGİSAYAR KASASI ( İ5-\n13400F, 16GB DDR4 RAM\n1 , 500GB SSD, 2GB EKRAN 4 Adet 20.000,00000000 TL %20,00 16.000,00 TL 80.000,00 TL\nKARTI ,400W POWER\nKASA ÖZELLİKLERİNDE)\n24 ASUS VZ24EHF IPS FHD\n2 1 Adet 5.780,00000000 TL %20,00 1.156,00 TL 5.780,00 TL\n100MZ 1MS HDMI\nMal Hizmet Toplam Tutarı 85.780,00 TL\nToplam İskonto 0,00 TL\nHesaplanan KDV(%20) 17.156,00 TL\nVergiler Dahil Toplam Tutar 102.936,00 TL\nÖdenecek Tutar 102.936,00 TL\nE Fatura Not Kısmı\n#Yüz İki Bin Dokuz Yüz Otuz Altı Türk Lirası #"
    },
    {
        "yapilandirilmis_veri": {
            "fatura_no": "SEM2025000000068",
            "fatura_tarihi": "12-08-2025",
            "duzenleme_saati": "14:22:48",
            "ettn": "c2bb5e37-d0ba-4a04-b91e-8fb458bcb2d9",
            "siparis_no": "tep112",
            "mal_hizmet_toplam_tutari": "123.123,00 TL",
            "para_birimi": "TL",
            "senaryo": "TEMELFATURA",
            "fatura_tipi_kod": "SATIS",
            "siparis_tarihi": "09-08-2025",
            "alici_vergi_dairesi": "Kozyatağı",
            "urun_kalemleri": []
        },
        "ham_metin": "Gerçek Oto Lastik Sanayi Tic. Ltd. Şti.\nİçerenköy Mah. Oto Sanayi Sitesi No:28\nAtaşehir/ İstanbul\nVergi Dairesi: Kozyatağı\nVKN: 9000068418\ne-FATURA\nÖzelleştirme No: TR1.2\nSenaryo: TEMELFATURA\nSAYIN\nFatura Tipi: SATIS\nLastikpark (Tatko)\nFatura No: SEM2025000000068\naadwqd\nFatura Tarihi: 12-08-2025\nkadıköy/ istanbul\nDüzenleme Tarihi: 12-08-2025\nTel: (234) 234 24-24\nVergi Dairesi: BÜYÜK MÜKELLEF Düzenleme Saati: 14:22:48\nVKN: 9000068418 Sipariş No: tep112\nSipariş Tarihi: 09-08-2025\nETTN: c2bb5e37-d0ba-4a04-b91e-8fb458bcb2d9\nSıra İskonto İskonto KDV\nMal Hizmet Miktar Birim Fiyat KDV Tutarı Diğer Vergiler Mal Hizmet Tutarı\nNo Oranı Tutarı Oranı\n1 test 1 1 Adet123.123,00000000 TL 0,00 TL %20,00 24.624,60 TL 123.123,00 TL\nMal Hizmet Toplam Tutarı 123.123,00 TL\nToplam İskonto 0,00 TL\nHesaplanan KDV(%20) 24.624,60 TL\nVergiler Dahil Toplam Tutar 147.747,60 TL\nÖdenecek Tutar 147.747,60 TL\n#yüzkırkyedibinyediyüzkırkyediTLaltmışKR#\n.\nFatura Notu:"
    },
    {
        "yapilandirilmis_veri": {
            "fatura_no": "NYS2025000000191",
            "fatura_tarihi": "05-07-2025",
            "duzenleme_saati": "14:57:04",
            "ettn": "ccacfd94-c639-4f87-8bbc-9b485684b2d4",
            "siparis_no": "354",
            "mal_hizmet_toplam_tutari": "85.780,00 TL",
            "para_birimi": "TL",
            "senaryo": "TICARIFATURA",
            "fatura_tipi_kod": "SATIS",
            "siparis_tarihi": "03-07-2025",
            "alici_vergi_dairesi": "Büyükçekmece",
            "urun_kalemleri": []
        },
        "ham_metin": "GANİMET BİLİŞİM ELEKTRİK ELEKTRONİK BİLGİSAYAR TEKNİK\nDESTEK VE DANIŞMANLIK HİZM.SAN.TİC.LTD.ŞTİ.\nFerhatpaşa Mah. Atatürk Cad. No:61 Çatalca İstanbul\nVergi Dairesi: Büyükçekmece VD.\nVKN: 9000068418\ne-FATURA\nÖzelleştirme No: TR1.2\nSenaryo: TICARIFATURA\nFatura Tipi: SATIS\nFatura No: NYS2025000000191\nFatura Tarihi: 05-07-2025\nSAYIN\nDüzenleme Tarihi: 05-07-2025\nUyumsoft Test Firma\nTürkiye Düzenleme Saati: 14:57:04\nVKN: 9000068418 Sipariş No: 354\nSipariş Tarihi: 03-07-2025\nETTN: ccacfd94-c639-4f87-8bbc-9b485684b2d4\nSıra İskonto İskonto KDV\nMal Hizmet Miktar Birim Fiyat KDV Tutarı Diğer Vergiler Mal Hizmet Tutarı\nNo Oranı Tutarı Oranı\nBİLGİSAYAR KASASI ( İ5-\n13400F, 16GB DDR4 RAM\n1 , 500GB SSD, 2GB EKRAN 4 Adet 20.000,00000000 TL %20,00 16.000,00 TL 80.000,00 TL\nKARTI ,400W POWER\nKASA ÖZELLİKLERİNDE)\n24 ASUS VZ24EHF IPS FHD\n2 1 Adet 5.780,00000000 TL %20,00 1.156,00 TL 5.780,00 TL\n100MZ 1MS HDMI\nMal Hizmet Toplam Tutarı 85.780,00 TL\nToplam İskonto 0,00 TL\nHesaplanan KDV(%20) 17.156,00 TL\nVergiler Dahil Toplam Tutar 102.936,00 TL\nÖdenecek Tutar 102.936,00 TL\nE Fatura Not Kısmı\n#Yüz İki Bin Dokuz Yüz Otuz Altı Türk Lirası #"
    },
    {
        "yapilandirilmis_veri": {
            "fatura_no": "OGZ2025000000653",
            "fatura_tarihi": "11-06-2025",
            "duzenleme_saati": "12:48:00",
            "ettn": "9a1f2255-b84a-4dfb-a8b5-79514a41df95",
            "mal_hizmet_toplam_tutari": "250.000,00",
            "doviz_kuru": "39.000000",
            "para_birimi": "TL",
            "senaryo": "TEMELFATURA",
            "fatura_tipi_kod": "SATIS",
            "alici_vergi_dairesi": "ataşehir",
            "urun_kalemleri": []
        },
        "ham_metin": "UYUMSOFT BİLGİ SİSTEMLERİ VE TEKNOLOJİLERİ TİCARET\nANONİM ŞİRKETİ\ndeddekorklur mahallesi atakent caddesi\n42000 Zincirlikuyu/ İstanbul\nTel: 9995555566666644\nE-Posta: deneme@deneme.com\nVergi Dairesi: 30 ağustos\nVKN: 9000068418 e-FATURA\nÖzelleştirme No: TR1.2\nSenaryo: TEMELFATURA\nFatura Tipi: SATIS\nSAYIN\nFatura No: OGZ2025000000653\nenoca\nFatura Tarihi: 11-06-2025\nataşehir/ istanbul\nVergi Dairesi: ataşehir Düzenleme Tarihi: 11-06-2025\nVKN: 9000068418 Düzenleme Saati: 12:48:00\nDöviz Kuru: 39.000000 TL\nETTN: 9a1f2255-b84a-4dfb-a8b5-79514a41df95\nSıra İskonto İskonto KDV\nMal Hizmet Miktar Birim Fiyat KDV Tutarı Diğer Vergiler Mal Hizmet Tutarı\nNo Oranı Tutarı Oranı\n250.000,00000000\n1 1 1 Adet %10,0025.000,00 USD 250.000,00 USD\nUSD\nMal Hizmet Toplam Tutarı 250.000,00 USD\nToplam İskonto 0,00 USD\nHesaplanan KDV(%10.00) 25.000,00 USD\nVergiler Dahil Toplam Tutar 275.000,00 USD\nÖdenecek Tutar 275.000,00 USD\nMal Hizmet Toplam Tutarı(TL) 9.750.000,00 TL\nToplam İskonto(TL) 0,00 TL\nHesaplanan KDV(%10.00)(TL) 975.000,00 TL\n10.725.000,00\nVergiler Dahil Toplam Tutar(TL)\nTL\n10.725.000,00\nÖdenecek Tutar(TL)\nTL\nYalnız #İki Yüz Yetmiş Beş Bin Dolar#\nasdas"
    },
    {
        "yapilandirilmis_veri": {
            "fatura_no": "SIM2018040000011",
            "fatura_tarihi": "11-04-2018",
            "duzenleme_saati": "15:22:07",
            "ettn": "298d5814-fdfc-4fec-9652-1b49413550a0",
            "mal_hizmet_toplam_tutari": "95.881,11 TL",
            "para_birimi": "TL",
            "senaryo": "TICARIFATURA",
            "fatura_tipi_kod": "SATIS",
            "irsaliye_no": "GRN2018000000017",
            "irsaliye_tarihi": "11-04-2018",
            "satici_adres": "leri4444den3ee555 Fatura Tarihi: 11-04-2018 9999999 KOCASİNAN 8/ KAYSERİ 6 Düzenleme Tarihi: 11-04-2018",
            "alici_adres": "leri4444den3ee555 Fatura Tarihi: 11-04-2018 9999999 KOCASİNAN 8/ KAYSERİ 6 Düzenleme Tarihi: 11-04-2018",
            "alici_vergi_dairesi": "Gevher",
            "urun_kalemleri": []
        },
        "ham_metin": "Uyumsoft Bilgi Sistemleri ve Teknolojileri A.Ş.\nHastane Cad.\n06606 MELİKGAZİ/ KAYSERİ\nTel: 03523525252\nWeb Sitesi: www.hh.com\nE-Posta: zzz@zz.com\nVergi Dairesi: Gevher Nesibe\nVKN: 9000068418 e-FATURA\nÖzelleştirme No: TR1.2\nSenaryo: TICARIFATURA\nSAYIN\nFatura Tipi: SATIS\nUyumsoft\nFatura No: SIM2018040000011\n333denemee adresleri4444den3ee555\nFatura Tarihi: 11-04-2018\n9999999 KOCASİNAN 8/ KAYSERİ 6\nDüzenleme Tarihi: 11-04-2018\nTel: 3521111111111\nVergi Dairesi: GÜRÜN Düzenleme Saati: 15:22:07\nVKN: 9000068418 İrsaliye No: GRN2018000000017\nİrsaliye Tarihi: 11-04-2018\nETTN: 298d5814-fdfc-4fec-9652-1b49413550a0\nSıra İskonto İskonto KDV\nMal Hizmet Miktar Birim Fiyat KDV Tutarı Diğer Vergiler Mal Hizmet Tutarı\nNo Oranı Tutarı Oranı\n1 İŞLEMCİ I7 - (INTEL) 35 Adet 963,25000000 TL %8,00 2.697,10 TL 33.713,75 TL\n2 DDR3 ANAKART - (ASUS) 27 Adet 453,26800000 TL %18,00 2.202,88 TL 12.238,24 TL\n16 GB DDR3 RAM -\n3 14 Adet 326,32500000 TL %18,00 822,34 TL 4.568,55 TL\n(CORSAIR)\n4 DDR3 ANAKART - (ASUS) 36 Adet 453,26800000 TL %18,00 2.937,18 TL 16.317,65 TL\n16 GB DDR3 RAM -\n5 88 Adet 326,32500000 TL %18,00 5.168,99 TL 28.716,60 TL\n(CORSAIR)\n16 GB DDR3 RAM -\n6 1 Adet 326,32500000 TL %18,00 58,74 TL 326,33 TL\n(CORSAIR)\nMal Hizmet Toplam Tutarı 95.881,11 TL\nToplam İskonto 0,01 TL\nHesaplanan KDV(%8) 2.697,10 TL\nHesaplanan KDV(%18) 11.190,13 TL\nVergiler Dahil Toplam Tutar 109.768,35 TL\nÖdenecek Tutar 109.768,35 TL\n#N#TOPLAM_HAM_TUTAR#95881.11\n#N#GENEL_TOPLAMA_CUR#109768.35\n#N#TOPLAM_KDV_TUTARI_CUR#13887.23\n#N#GENEL_TOPLAM_CUR#109768.35\nSicil No: 111111111\nMersis No: 1111111111111111\nİşletme Merkezi: KAYSERİ\nYAZI İLE: YüzDokuzBinYediYüzAltmışSekiz TL OtuzBeş Kuruş\nOnly: One Hundred Nine Thousand Seven Hundred Sixty Eight TL And Thirty Five Kuruş\nÖdeme Notu: VADE TARİHİ: 2018-04-11"
    },
    {
        "yapilandirilmis_veri": {
            "fatura_no": "HMF2024000000001",
            "fatura_tarihi": "14-05-2024",
            "duzenleme_saati": "11:40:00",
            "ettn": "71536c19-24a0-4377-88ea-ac81087730c7",
            "odenecek_tutar": ".",
            "mal_hizmet_toplam_tutari": "65.480,00 TL",
            "para_birimi": "TL",
            "senaryo": "TICARIFATURA",
            "fatura_tipi_kod": "SATIS",
            "alici_vergi_dairesi": "TOKAT",
            "urun_kalemleri": []
        },
        "ham_metin": "HM GROUP\nVergi Dairesi: TOKAT VERGİ DAİRESİ\nVKN: 9000068418\ne-FATURA\nÖzelleştirme No: TR1.2\nSenaryo: TICARIFATURA\nFatura Tipi: SATIS\nSAYIN\nFatura No: HMF2024000000001\nXXX Mağazacıık A.Ş.\nÖRNEK ADRES Fatura Tarihi: 14-05-2024\nVKN: 9000068418 Düzenleme Tarihi: 14-05-2024\nDüzenleme Saati: 11:40:00\nETTN: 71536c19-24a0-4377-88ea-ac81087730c7\nSıra İskonto İskonto KDV\nMal Hizmet Miktar Birim Fiyat KDV Tutarı Diğer Vergiler Mal Hizmet Tutarı\nNo Oranı Tutarı Oranı\n1 xyz buzdolabı 1 Adet 32.740,00000000 TL %20,00 13.096,00 TL 65.480,00 TL\nMal Hizmet Toplam Tutarı 65.480,00 TL\nToplam İskonto 0,00 TL\nHesaplanan KDV(%20.00) 13.096,00 TL\nVergiler Dahil Toplam Tutar 78.576,00 TL\nÖdenecek Tutar 78.576,00 TL\n#YALNIZ YETMİŞSEKİZBİNBEŞYÜZYETMİŞALTI TRL #\nSevk Adresi :\nXXX Mağazacıık A.Ş.\nsevk adresi"
    },
    {
        "yapilandirilmis_veri": {
            "fatura_no": "SEM2025000000051",
            "fatura_tarihi": "08-08-2025",
            "duzenleme_saati": "17:40:28",
            "ettn": "e999d3cd-33c7-412d-b435-498f79c0814d",
            "siparis_no": "160584",
            "mal_hizmet_toplam_tutari": "101.700,00 TL",
            "para_birimi": "TL",
            "senaryo": "TEMELFATURA",
            "fatura_tipi_kod": "SATIS",
            "siparis_tarihi": "08-08-2025",
            "satici_adres": "No : 123/A Maltepe/ İstanbul",
            "alici_adres": "No : 123/A Maltepe/ İstanbul",
            "alici_vergi_dairesi": "Kozyatağı",
            "urun_kalemleri": []
        },
        "ham_metin": "Gerçek Oto Lastik Sanayi Tic. Ltd. Şti.\nÖrnek Adres No : 123/A\nMaltepe/ İstanbul\nVergi Dairesi: Kozyatağı\nVKN: 9000068418\ne-FATURA\nÖzelleştirme No: TR1.2\nSenaryo: TEMELFATURA\nSAYIN\nFatura Tipi: SATIS\nFatura Testi Müşterisi\nFatura No: SEM2025000000051\nDeneme Adresi\nFatura Tarihi: 08-08-2025\nAtaşehir/ İstanbul\nDüzenleme Tarihi: 08-08-2025\nTel: (435) 353-5353\nVergi Dairesi: Kozyatağı Düzenleme Saati: 17:40:28\nVKN: 9000068418 Sipariş No: 160584\nSipariş Tarihi: 08-08-2025\nETTN: e999d3cd-33c7-412d-b435-498f79c0814d\nSıra İskonto İskonto KDV\nMal Hizmet Miktar Birim Fiyat KDV Tutarı Diğer Vergiler Mal Hizmet Tutarı\nNo Oranı Tutarı Oranı\nJant düzeltme (17\" ve\n1 3 Adet 13.000,00000000 TL 3.900,00 TL %20,00 7.020,00 TL 35.100,00 TL\nüzeri)\nRot Ayarı (UHP/ 4x4 H\n2 2 Adet 6.400,00000000 TL 2.560,00 TL %20,00 2.048,00 TL 10.240,00 TL\nTicari)\nLASSA Greenways\n3 1 Adet 12.000,00000000 TL 3.600,00 TL %20,00 1.680,00 TL 8.400,00 TL\n185/65R15 88H\nSAVA Adapto HP\n4 3 Adet 2.300,00000000 TL 0,00 TL %20,00 1.380,00 TL 6.900,00 TL\n195/60R15 88H M+S\nFALKEN Ziex ZE310 Ecorun\n5 2 Adet 11.000,00000000 TL 0,00 TL %20,00 4.400,00 TL 22.000,00 TL\n205/55R16 91V\n6 SONAX Hızlı Cila 500 ml 1 Adet 9.000,00000000 TL 0,00 TL %20,00 1.800,00 TL 9.000,00 TL\nMal Hizmet Toplam Tutarı 101.700,00 TL\nToplam İskonto 10.060,00 TL\nHesaplanan KDV(%20) 18.328,00 TL\nVergiler Dahil Toplam Tutar 109.968,00 TL\nÖdenecek Tutar 109.968,00 TL\n#yüzdokuzbindokuzyüzaltmışsekizTL#\n.\nFatura Notu:"
    },
    {
        "yapilandirilmis_veri": {
            "fatura_no": "SEM2025000000052",
            "fatura_tarihi": "08-08-2025",
            "duzenleme_saati": "17:45:44",
            "ettn": "5a8bb20f-667e-4642-8734-19ea0e4c8539",
            "siparis_no": "Sipariş",
            "mal_hizmet_toplam_tutari": "101.700,00 TL",
            "para_birimi": "TL",
            "senaryo": "TICARIFATURA",
            "fatura_tipi_kod": "SATIS",
            "siparis_tarihi": "08-08-2025",
            "satici_adres": "No : 123/A Maltepe/ İstanbul",
            "alici_adres": "No : 123/A Maltepe/ İstanbul",
            "alici_vergi_dairesi": "Kozyatağı",
            "urun_kalemleri": []
        },
        "ham_metin": "Gerçek Oto Lastik Sanayi Tic. Ltd. Şti.\nÖrnek Adres No : 123/A\nMaltepe/ İstanbul\nVergi Dairesi: Kozyatağı\nVKN: 9000068418\nR\ne-FATURA\ne Özelleştirme No: TR1.2\nSenaryo: TICARIFATURA\nd\nSAYIN\nFatura Tipi: SATIS\nFatura Testi Müşterisi\nd Fatura No: SEM2025000000052\nDeneme Adresi\nFatura Tarihi: 08-08-2025\nAtaşehir/ İstanbul e\nDüzenleme Tarihi: 08-08-2025\nTel: (435) 353-5353\nVergi Dairesi: Kozyatağı d Düzenleme Saati: 17:45:44\nVKN: 9000068418 i Sipariş No: -\nSipariş Tarihi: 08-08-2025\nl\nETTN: 5a8bb20f-667e-4642-8734-19ea0e4c8539 d\nSıra İskonto İiskonto KDV\nMal Hizmet Miktar Birim Fiyat KDV Tutarı Diğer Vergiler Mal Hizmet Tutarı\nNo Oranı Tutarı Oranı\n1 test 1 3 Adet 13.000,00000000 TL 3.900,00 TL %20,00 7.020,00 TL 35.100,00 TL\n2 test 2 2 Adet 6.400,00000000 TL 2.560,00 TL %20,00 2.048,00 TL 10.240,00 TL\n3 test 3 1 Adet 12.000,00000000 TL 3.600,00 TL %20,00 1.680,00 TL 8.400,00 TL\n4 test 4 3 Adet 2.300,00000000 TL 0,00 TL %20,00 1.380,00 TL 6.900,00 TL\n5 test 5 2 Adet 11.000,00000000 TL 0,00 TL %20,00 4.400,00 TL 22.000,00 TL\n6 test 6 1 Adet 9.000,00000000 TL 0,00 TL %20,00 1.800,00 TL 9.000,00 TL\nMal Hizmet Toplam Tutarı 101.700,00 TL\nToplam İskonto 10.060,00 TL\nHesaplanan KDV(%20) 18.328,00 TL\nVergiler Dahil Toplam Tutar 109.968,00 TL\nÖdenecek Tutar 109.968,00 TL\n#yüzdokuzbindokuzyüzaltmışsekizTL#\n.\nFatura Notu:"
    },
    {
        "yapilandirilmis_veri": {
            "fatura_no": "SEM2025000000050",
            "fatura_tarihi": "08-08-2025",
            "duzenleme_saati": "17:16:04",
            "ettn": "56fdd2ba-f122-477b-9096-a3de993bf74c",
            "siparis_no": "Sipariş",
            "mal_hizmet_toplam_tutari": "101.700,00 TL",
            "para_birimi": "TL",
            "senaryo": "TICARIFATURA",
            "fatura_tipi_kod": "SATIS",
            "siparis_tarihi": "08-08-2025",
            "satici_adres": "i Fatura Tarihi: 08-08-2025 Ataşehir/ İstanbul Düzenleme Tarihi: 08-08-2025",
            "alici_adres": "i Fatura Tarihi: 08-08-2025 Ataşehir/ İstanbul Düzenleme Tarihi: 08-08-2025",
            "alici_vergi_dairesi": "Kozyatağı",
            "urun_kalemleri": []
        },
        "ham_metin": "Gerçek Oto Lastik Sanayi Tic. Ltd. Şti.\nİçerenköy Mah. Oto Sanayi Sitesi No:28\nAtaşehir/ İstanbul\nVergi Dairesi: Kozyatağı\nVKN: 9000068418\ne-FATURA\nÖzelleştirme No: TR1.2\nSenaryo: TICARIFATURA\nSAYIN\nFatura Tipi: SATIS\nFatura Testi Müşterisi\nFatura No: SEM2025000000050\nDeneme Adresi\nFatura Tarihi: 08-08-2025\nAtaşehir/ İstanbul\nDüzenleme Tarihi: 08-08-2025\nTel: (435) 353-5353\nVergi Dairesi: Kozyatağı Düzenleme Saati: 17:16:04\nVKN: 9000068418 Sipariş No: -\nSipariş Tarihi: 08-08-2025\nETTN: 56fdd2ba-f122-477b-9096-a3de993bf74c\nSıra İskonto İskonto KDV\nMal Hizmet Miktar Birim Fiyat KDV Tutarı Diğer Vergiler Mal Hizmet Tutarı\nNo Oranı Tutarı Oranı\nİş Emri No:367177 | Rot\n1 3 Adet 13.000,00000000 TL 3.900,00 TL %20,00 7.800,00 TL 35.100,00 TL\nAyarı (Binek)\nİş Emri No:367177 | LASSA\n2 LASSA GREENWAYS 2 Adet 6.400,00000000 TL 2.560,00 TL %20,00 2.560,00 TL 10.240,00 TL\n185/65R15 88H\nİş Emri No:367178 | Rot\n3 1 Adet 12.000,00000000 TL 3.600,00 TL %20,00 2.400,00 TL 8.400,00 TL\nAyarı (Binek)\nİş Emri No:367178 | LASSA\n4 Multiways 2 185/65R15 3 Adet 2.300,00000000 TL 0,00 TL %20,00 1.380,00 TL 6.900,00 TL\n92V XL M+S 3PMSF\nİş Emri No:367179 | Rot\n5 2 Adet 11.000,00000000 TL 0,00 TL %20,00 4.400,00 TL 22.000,00 TL\nAyarı (Binek)\nİş Emri No:367179 | LASSA\n6 Greenways 185/65R15 1 Adet 9.000,00000000 TL 0,00 TL %20,00 1.800,00 TL 9.000,00 TL\n88H\nMal Hizmet Toplam Tutarı 101.700,00 TL\nToplam İskonto 10.060,00 TL\nHesaplanan KDV(%20) 18.328,00 TL\nVergiler Dahil Toplam Tutar 109.968,00 TL\nÖdenecek Tutar 109.968,00 TL\n#yüzdokuzbindokuzyüzaltmışsekizTL#\n.\nFatura Notu:"
    },
    {
        "yapilandirilmis_veri": {
            "fatura_no": "MM12025000000009",
            "fatura_tarihi": "18-06-2025",
            "duzenleme_saati": "16:08:00",
            "ettn": "accbc80e-2b5e-4c6c-9571-9154fe8e6929",
            "odenecek_tutar": "81.600,00 TRY",
            "mal_hizmet_toplam_tutari": "68.000,00 TL",
            "yazi_ile_tutar": "SEKSENBİRBİNALTIYÜZ TRY # İş bu fatura = 81.600,00 TRY, Kur:1,000000 Karşılığı 81.600,00",
            "para_birimi": "TL",
            "senaryo": "TEMELFATURA",
            "fatura_tipi_kod": "SATIS",
            "irsaliye_no": "MRT2025000000004",
            "irsaliye_tarihi": "17-06-2025",
            "alici_vergi_dairesi": "POZANTI",
            "urun_kalemleri": []
        },
        "ham_metin": "MERT - ÖZNUR - ELİF EĞİTİM FİRMASI\nAAAA AAA\nTOKAT MERKEZ/ TOKAT\nTel: (___) ___ __ __ Fax: (___) ___ __ __\nE-Posta: mert.alparslan@uyumsoft.com\nVergi Dairesi: 19 MAYIS\nVKN: 9000068418\ne-FATURA\nÖzelleştirme No: TR1.2\nSenaryo: TEMELFATURA\nFatura Tipi: SATIS\nSAYIN\nFatura No: MM12025000000009\nUYUMSOFT BİLGİ SİSTEMLERİ SİVAS\nFatura Tarihi: 18-06-2025\nAAAAAA AAAA\nDüzenleme Tarihi: 18-06-2025\nADALAR/ İSTANBUL\nVergi Dairesi: POZANTI Düzenleme Saati: 16:08:00\nVKN: 9000068418 İrsaliye No: MRT2025000000004\nİrsaliye Tarihi: 17-06-2025\nETTN: accbc80e-2b5e-4c6c-9571-9154fe8e6929\nSıra İskonto İskonto KDV\nMal Hizmet Miktar Birim Fiyat KDV Tutarı Diğer Vergiler Mal Hizmet Tutarı\nNo Oranı Tutarı Oranı\n1 APPLE İPHONE 15 2 Adet 34.000,00000000 TL %20,00 13.600,00 TL 68.000,00 TL\nMal Hizmet Toplam Tutarı 68.000,00 TL\nToplam İskonto 0,00 TL\nHesaplanan GERÇEK USULDE KATMA\n13.600,00 TL\nDEĞER VERGİSİ(%20.00)\nVergiler Dahil Toplam Tutar 81.600,00 TL\nÖdenecek Tutar 81.600,00 TL\n#YALNIZ SEKSENBİRBİNALTIYÜZ TRY #\nİş bu fatura = 81.600,00 TRY, Kur:1,000000 Karşılığı 81.600,00 TL dir.\nMM12025000000009 numaralı fatura\nSevk Adresi :\nAAA\nAAA\nTOKAT\nALMUS\n60100\nTÜRKİYE"
    },
    {
        "yapilandirilmis_veri": {
            "fatura_no": "SAM2025000000015",
            "fatura_tarihi": "16-06-2025",
            "duzenleme_saati": "00:00:00",
            "ettn": "37B09D26-CD76-0C7A-E063-6500000AA366",
            "siparis_no": "114314",
            "odenecek_tutar": ".",
            "mal_hizmet_toplam_tutari": "79.581,00 TL",
            "yazi_ile_tutar": "DoksanBeşBinDörtYüzDoksanYedi",
            "para_birimi": "TL",
            "senaryo": "TICARIFATURA",
            "fatura_tipi_kod": "SATIS",
            "siparis_tarihi": "06-05-2025",
            "alici_vergi_dairesi": "İlyasbey",
            "urun_kalemleri": []
        },
        "ham_metin": "SAMM TEKNOLOJİ İLETİŞİM SAN. VE TİC.A.Ş.\nGebze Organize Sanayi Bölgesi (GOSB) İhsandede Cd. 800. Sok\nNo: 802 Gebze\nKOCAELİ\nTel: İlyasbey Fax: 0 262 677 1681\nWeb Sitesi: www.samm.com\nE-Posta: muhasebe@samm.com\nR\nVergi Dairesi: İlyasbey\ne-FATURA\nVKN: 9000068418\ne\nd\nSAYIN Özelleştirme No: TR1.2\nKormas Elektrikli Motor San. ve Tic. A.Ş. d Senaryo: TICARIFATURA\nTOSB Otomotiv Yan San. İhtisas Bölgesi, 1. Cd. No: 30, 41420 Fatura Tipi: SATIS\nTosb Otomotiv Osb e\nFatura No: SAM2025000000015\nÇAYIROVA/ KOCAELİ\nd Fatura Tarihi: 16-06-2025\nE-Posta: busrakocoglu@kormas.com\nDüzenleme Tarihi: 16-06-2025\nTel: 90 262 6582140 i\nVergi Dairesi: İLYASBEY l Düzenleme Saati: 00:00:00\nVKN: 9000068418 d Sipariş No: 114314\nSipariş Tarihi: 06-05-2025\ni\nETTN: 37B09D26-CD76-0C7A-E063-6500000AA366\nSıra İskonto İskonto KDV\nMal Hizmet Miktar Birim Fiyat KDV Tutarı Diğer Vergiler Mal Hizmet Tutarı\nNo Oranı Tutarı Oranı\n963205-1 FACIAL SEAL,\n5.000\n1 6POS, SILICONE, 15,91620000 TL %20,00 15.916,20 TL 79.581,00 TL\nAdet\nNATURAL\nMal Hizmet Toplam Tutarı 79.581,00 TL\nToplam İskonto\nHesaplanan Gerçek Usulde Katma\n15.916,20 TL\nDeğer Vergisi(%20)\nVergiler Dahil Toplam Tutar 95.497,20 TL\nÖdenecek Tutar 95.497,20 TL\nOracle Sipariş No:114314\nYALNIZ: DoksanBeşBinDörtYüzDoksanYediTürkLirasıYirmiKuruş\nÖdeme Koşulu:Peşin\nGeri bildirimlerinize değer veriyoruz. Değerli geri bildirimlerinizi paylaşmak için aşağıdaki bağlantıya tıklayabilirsiniz."
    },
    {
        "yapilandirilmis_veri": {
            "fatura_no": "ARD2023000000022",
            "fatura_tarihi": "22-05-2023",
            "duzenleme_saati": "00:00:00",
            "ettn": "5cae3a82-f911-449c-aac7-2a22f1746dc0",
            "mal_hizmet_toplam_tutari": "100.000,00 TL",
            "yazi_ile_tutar": "YüzOnSekizBin",
            "para_birimi": "TL",
            "senaryo": "TEMELFATURA",
            "fatura_tipi_kod": "SATIS",
            "alici_vergi_dairesi": "Çankaya",
            "urun_kalemleri": []
        },
        "ham_metin": "TEST Uhap Kullanıcısı\nÇANKAYA/ ANKARA\nTel: 5555555555\nE-Posta: info@info.com\nVergi Dairesi: Çankaya Vergi Dairesi Müdürlüğü\nVKN: 0730712912\nTICARETSICILNO: 555555\nMERSISNO: 5555555555555555 e-FATURA\nÖzelleştirme No: TR1.2\nSenaryo: TEMELFATURA\nFatura Tipi: SATIS\nSAYIN\nFatura No: ARD2023000000022\nUyumsoft Bilgi Sistem.ve Tekno.Tic.A.Ş.\n06500 Merkez/ ANKARA Fatura Tarihi: 22-05-2023\nVKN: 9000068418 Düzenleme Tarihi: 22-05-2023\nDüzenleme Saati: 00:00:00\nETTN: 5cae3a82-f911-449c-aac7-2a22f1746dc0\nSıra İskonto İskonto KDV\nMal Hizmet Miktar Birim Fiyat KDV Tutarı Diğer Vergiler Mal Hizmet Tutarı\nNo Oranı Tutarı Oranı\n1.000\n1 SS 100,00000000 TL %0,00 0,00 TL %18,00 18.000,00 TL 100.000,00 TL\nAdet\nMal Hizmet Toplam Tutarı 100.000,00 TL\nToplam İskonto 0,00 TL\nHesaplanan KDV(%18.00) 18.000,00 TL\nVergiler Dahil Toplam Tutar 118.000,00 TL\nÖdenecek Tutar 118.000,00 TL\nYalnız YüzOnSekizBin TL Sıfır Kuruş"
    },
    {
        "yapilandirilmis_veri": {
            "fatura_no": "BCK2023000000006",
            "fatura_tarihi": "14-04-2023",
            "duzenleme_saati": "15:27:04",
            "ettn": "7CA9B45F-818C-433A-BEED-DDBF5AAC52A2",
            "siparis_no": "SO0000077",
            "odenecek_tutar": ".",
            "mal_hizmet_toplam_tutari": "90.000,00",
            "doviz_kuru": "20.2400",
            "para_birimi": "TL",
            "senaryo": "TEMELFATURA",
            "fatura_tipi_kod": "SATIS",
            "irsaliye_no": "PS0000028",
            "irsaliye_tarihi": "28-03-2023",
            "siparis_tarihi": "14-04-2023",
            "urun_kalemleri": []
        },
        "ham_metin": "Becker Coating Boya Sanayi ve Ticaret Ltd. Şti.\nGüzeller Organize Sanayi Bölgesi, İnönü mah. Alptegin Sok. No.7\n41400\nTel: 0262 502 00 80\nWeb Sitesi: www.beckers-group.com\nE-Posta: info-tr@beckers-group.com\nVKN: 9000068418\ne-FATURA\nÖzelleştirme No: TR1.2\nSenaryo: TEMELFATURA\nFatura Tipi: SATIS\nFatura No: BCK2023000000006\nFatura Tarihi: 14-04-2023\nDüzenleme Tarihi: 14-04-2023\nDüzenleme Saati: 15:27:04\nSAYIN\nİrsaliye No: PS0000028\nAssan Aluminyum San.Tic.A.S.\nİrsaliye Tarihi: 28-03-2023\nYAYLA MAH. D-100 KARAYOLURUYA SOK. N° 2\n34940 Sipariş No: SO0000077\nVKN: 9000068418 Sipariş Tarihi: 14-04-2023\nDöviz Kuru: 20.2400 TL\nETTN: 7CA9B45F-818C-433A-BEED-DDBF5AAC52A2\nSıra İskonto İskonto KDV\nMal Hizmet Miktar Birim Fiyat KDV Tutarı Diğer Vergiler Mal Hizmet Tutarı\nNo Oranı Tutarı Oranı\nBeckryPol 310 Monocoat\nMES1003 Platinum White /\n1 200 Adet 450,00000000 EUR %0,00 0,00 EUR %18,0016.200,00 EUR 90.000,00 EUR\nBeckryPol 310 Monocoat\nMES1003 Platinum White\nMal Hizmet Toplam Tutarı 90.000,00 EUR\nToplam İskonto 0,00 EUR\nHesaplanan GERÇEK USULDE KATMA\n16.200,00 EUR\nDEĞER VERGİSİ(%18.00)\nVergiler Dahil Toplam Tutar 106.200,00 EUR\nÖdenecek Tutar 106.200,00 EUR\nMal Hizmet Toplam Tutarı(TL) 1.821.600,00 TL\nToplam İskonto(TL) 0,00 TL\nHesaplanan GERÇEK USULDE KATMA\n327.888,00 TL\nDEĞER VERGİSİ(%18.00)(TL)\nVergiler Dahil Toplam Tutar(TL) 2.149.488,00 TL\nÖdenecek Tutar(TL) 2.149.488,00 TL\nYalnız : YüzAltıBinİkiYüz\nBUalandaki bilgiler tüm faturalarda görülecektir.\nAx İnvoice No: TRCI0000020\nDöviz kuru : 20.24000 TRY\nMersis no: 0760046045500020\nÖdeme Koşulu: Fatura vade tarihi: 2023-08-12"
    },
    {
        "yapilandirilmis_veri": {
            "fatura_no": "SND2024000000004",
            "fatura_tarihi": "15-03-2024",
            "duzenleme_saati": "11:29:28",
            "ettn": "27d06435-9c77-4a8f-8148-828bb7b63e84",
            "mal_hizmet_toplam_tutari": "91.666,67 TL",
            "para_birimi": "TL",
            "senaryo": "TICARIFATURA",
            "fatura_tipi_kod": "SATIS",
            "alici_vergi_dairesi": "MERKEZ",
            "urun_kalemleri": []
        },
        "ham_metin": "NETCOM\nzorunlu\n38700 ZORUNLU/ ZORUNLU\nVergi Dairesi: MERKEZ\nVKN: 9000068418\ne-FATURA\nÖzelleştirme No: TR1.2\nSAYIN\nSenaryo: TICARIFATURA\nKOÇAK PIRLANTA\nFatura Tipi: SATIS\nYıldırım Beyazıd mah. mevlana cad BAL AP\nFatura No: SND2024000000004\n04000 HAMUR/ AĞRI\nVergi Dairesi: AĞRI Fatura Tarihi: 15-03-2024\nVKN: 9000068418 Düzenleme Tarihi: 15-03-2024\nDüzenleme Saati: 11:29:28\nETTN: 27d06435-9c77-4a8f-8148-828bb7b63e84\nSıra İskonto İskonto KDV\nMal Hizmet Miktar Birim Fiyat KDV Tutarı Diğer Vergiler Mal Hizmet Tutarı\nNo Oranı Tutarı Oranı\n1 ALDA GENÇ ODASI 1 Adet 20.833,33333300 TL %20,00 4.166,67 TL 20.833,33 TL\n2 KULA GENÇ ODASI 1 Adet 33.333,33333300 TL %20,00 6.666,67 TL 33.333,33 TL\n3 MİNA GENÇ ODASI 1 Adet 37.500,00000000 TL %20,00 7.500,00 TL 37.500,00 TL\nMal Hizmet Toplam Tutarı 91.666,67 TL\nToplam İskonto 0,01 TL\nHesaplanan KDV(%20) 18.333,33 TL\nVergiler Dahil Toplam Tutar 109.999,99 TL\nÖdenecek Tutar 109.999,99 TL\nSicil No:\nMersis No: 1616161616161616\nİşletme Merkezi: ZORUNLU\nYAZI İLE: YüzDokuzBinDokuzYüzDoksanDokuz TL DoksanDokuz Kuruş\nÖdeme Notu: VADE TARİHİ: 2024-03-15 (PEŞİN)"
    },
    {
        "yapilandirilmis_veri": {
            "fatura_no": "KSN2025000000002",
            "fatura_tarihi": "18-06-2025",
            "duzenleme_saati": "11:40:00",
            "ettn": "89091ae5-38d3-420f-bfb2-635181ce19a8",
            "odenecek_tutar": "90.000,00 TRY",
            "mal_hizmet_toplam_tutari": "75.000,00 TL",
            "yazi_ile_tutar": "DOKSANBİN TRY # İş bu fatura = 90.000,00 TRY, Kur:1,000000 Karşılığı 90.000,00",
            "para_birimi": "TL",
            "senaryo": "TICARIFATURA",
            "fatura_tipi_kod": "SATIS",
            "alici_vergi_dairesi": "NİKSAR",
            "urun_kalemleri": []
        },
        "ham_metin": "ÖZNUR KESKİN\nNİKSAR/ TOKAT\nTel: (555) 555 55 55 Fax: (___) ___ __ __\nE-Posta: oznur.ozden@uyumsoft.com\nVergi Dairesi: NİKSAR\nVKN: 9000068418\ne-FATURA\nÖzelleştirme No: TR1.2\nSAYIN\nSenaryo: TICARIFATURA\nUYUMSOFT BİLGİ SİSTEMLERİ SİVAS\nFatura Tipi: SATIS\nAAAAAA AAAA\nFatura No: KSN2025000000002\nADALAR/ İSTANBUL\nVergi Dairesi: POZANTI Fatura Tarihi: 18-06-2025\nVKN: 9000068418 Düzenleme Tarihi: 18-06-2025\nDüzenleme Saati: 11:40:00\nETTN: 89091ae5-38d3-420f-bfb2-635181ce19a8\nSıra İskonto İskonto KDV\nMal Hizmet Miktar Birim Fiyat KDV Tutarı Diğer Vergiler Mal Hizmet Tutarı\nNo Oranı Tutarı Oranı\n1 APPLE KLAVYE 5 Adet 15.000,00000000 TL %20,00 15.000,00 TL 75.000,00 TL\nMal Hizmet Toplam Tutarı 75.000,00 TL\nToplam İskonto 0,00 TL\nHesaplanan GERÇEK USULDE KATMA\n15.000,00 TL\nDEĞER VERGİSİ(%20.00)\nVergiler Dahil Toplam Tutar 90.000,00 TL\nÖdenecek Tutar 90.000,00 TL\n#YALNIZ DOKSANBİN TRY #\nİş bu fatura = 90.000,00 TRY, Kur:1,000000 Karşılığı 90.000,00 TL dir.\nKSN2025000000002 UYUMSOFT BİLGİ SİSTEMLERİ SİVASNOLU FATURA\nUYUMSOFT BİLGİ SİSTEMLERİ SİVAS"
    },
    {
        "yapilandirilmis_veri": {
            "fatura_no": "HRC2023000000018",
            "fatura_tarihi": "23-05-2023",
            "duzenleme_saati": "16:13:00",
            "ettn": "7bf2ad45-ed3f-4f18-9450-3330a751ce00",
            "odenecek_tutar": "153.990,00 TRY",
            "mal_hizmet_toplam_tutari": "130.500,00 TL",
            "yazi_ile_tutar": "YÜZELLİÜÇBİNDOKUZYÜZDOKSAN TRY # İş bu fatura = 153.990,00 TRY, Kur:1,000000 Karşılığı 153.990,00",
            "para_birimi": "TL",
            "senaryo": "TEMELFATURA",
            "fatura_tipi_kod": "SATIS",
            "alici_vergi_dairesi": "İSTİKLAL",
            "urun_kalemleri": []
        },
        "ham_metin": "hicran mühendislik\nTOKAT MERKEZ/ TOKAT\nTel: (___) ___ __ __ Fax: (___) ___ __ __\nVergi Dairesi: 19 MAYIS\nVKN: 9000068418\ne-FATURA\nÖzelleştirme No: TR1.2\nSAYIN\nSenaryo: TEMELFATURA\nUYUMSOFT BİLGİ SİSTEMLERİ.\nFatura Tipi: SATIS\nHDHSKHFKSHF\nFatura No: HRC2023000000018\nTOKAT MERKEZ/ TOKAT\nVergi Dairesi: İSTİKLAL Fatura Tarihi: 23-05-2023\nVKN: 9000068418 Düzenleme Tarihi: 23-05-2023\nDüzenleme Saati: 16:13:00\nETTN: 7bf2ad45-ed3f-4f18-9450-3330a751ce00\nSıra İskonto İskonto KDV\nMal Hizmet Miktar Birim Fiyat KDV Tutarı Diğer Vergiler Mal Hizmet Tutarı\nNo Oranı Tutarı Oranı\n1 sigorta poliçesi 17,4 Adet 7.500,00000000 TL %18,00 23.490,00 TL 130.500,00 TL\nMal Hizmet Toplam Tutarı 130.500,00 TL\nToplam İskonto 0,00 TL\nHesaplanan KDV-(%18.00) 23.490,00 TL\nVergiler Dahil Toplam Tutar 153.990,00 TL\nÖdenecek Tutar 153.990,00 TL\n#YALNIZ YÜZELLİÜÇBİNDOKUZYÜZDOKSAN TRY #\nİş bu fatura = 153.990,00 TRY, Kur:1,000000 Karşılığı 153.990,00 TL dir.\nUYUMSOFT BİLGİ SİSTEMLERİ."
    },
    {
        "yapilandirilmis_veri": {
            "fatura_no": "PRT2024000003518",
            "fatura_tarihi": "07-09-2024",
            "duzenleme_saati": "00:00:00",
            "ettn": "3c63d314-264e-44a8-ac4c-09ffc69bac16",
            "mal_hizmet_toplam_tutari": "159.093,62 TL",
            "para_birimi": "TL",
            "senaryo": "TICARIFATURA",
            "fatura_tipi_kod": "SATIS",
            "irsaliye_tarihi": "01-09-2024",
            "alici_vergi_dairesi": "BEYKOZ",
            "urun_kalemleri": []
        },
        "ham_metin": "PARILTIM END.TOPLU YEMEK HİZ.TUR.SAN.VE TİC.A.Ş.\nGÖZTEPE MAH. EKSEN SOK. NO:8/1 BEYKOZ/ İSTANBUL İstanbul\n34815 Beykoz/ İstanbul\nTel: 0216 465 96 66 Fax: 0216 465 97 17\nWeb Sitesi: www.pariltim-newrest.com\nE-Posta: muhasebe@pariltim-newrest.eu\nVergi Dairesi: BEYKOZ\nVKN: 9000068418\nTICARETSICILNO: 702892-0 e-FATURA\nMERSISNO: 0721038111300018\nSAYIN\nYONCA GIDA SAN. İŞL. İÇ VE DIŞ TİC. A.Ş. Özelleştirme No: TR1.2\nİZZET GÖKDENİZ\nSenaryo: TICARIFATURA\nAlsancak Mah.1476/1 Sokak İsmet İş Merkezi Blok No:3 Kapı:7\nFatura Tipi: SATIS\n35220 KONAK / İZMİR\nFatura No: PRT2024000003518\nE-Posta: ch@yoncagida.com.tr\nFatura Tarihi: 07-09-2024\nTel: 0236 233 25 20\nVergi Dairesi: HASAN TAHSİN Düzenleme Tarihi: 07-09-2024\nVKN: 9000068418 Düzenleme Saati: 00:00:00\nİrsaliye Tarihi: 01-09-2024\nETTN: 3c63d314-264e-44a8-ac4c-09ffc69bac16\nSıra İskonto İskonto KDV\nMal Hizmet Miktar Birim Fiyat KDV Tutarı Diğer Vergiler Mal Hizmet Tutarı\nNo Oranı Tutarı Oranı\nÖĞLE YEMEĞİ- YONCA 1.045\n1 87,76000000 TL %10,00 9.170,92 TL 91.709,20 TL\nGIDA Adet\nAKŞAM YEMEĞİ-YONCA\n1 439 Adet 87,76000000 TL %10,00 3.852,66 TL 38.526,64 TL\nGIDA\n1 KAHVALTI-YONCA GIDA 518 Adet 55,71000000 TL %10,00 2.885,78 TL 28.857,78 TL\nMal Hizmet Toplam Tutarı 159.093,62 TL\nToplam İskonto 0,00 TL\nHesaplanan GERÇEK USÜLDE KATMA\n15.909,36 TL\nDEĞER VERGİSİ(%10)\nVergiler Dahil Toplam Tutar 175.002,98 TL\nÖdenecek Tutar 175.002,98 TL\n1-7.09 MERKEZ +SOSYAL\nyüz yetmiş beş bin iki türk lirası ve doksan sekiz kuruş\n#SEVKADRESI: İZZET GÖKDENİZ Alsancak Mah.1476/1 Sokak İsmet İş Merkezi Blok No:3 Kapı:7 KONAK 35220 İZMİR\n50.30.02 - İzmir MM\nKemalpaşa Osb. 18. Sok No:132 Kemalpaşa/ İzmir İzmir İzmir 34000 EGE BÖLGE"
    },
    {
        "yapilandirilmis_veri": {
            "fatura_no": "SND2024000000008",
            "fatura_tarihi": "18-03-2024",
            "duzenleme_saati": "08:51:49",
            "ettn": "38977a42-20c4-4a9c-9c27-eef261d9b4fd",
            "mal_hizmet_toplam_tutari": "112.500,00 TL",
            "para_birimi": "TL",
            "senaryo": "TICARIFATURA",
            "fatura_tipi_kod": "SATIS",
            "alici_vergi_dairesi": "MERKEZ",
            "urun_kalemleri": []
        },
        "ham_metin": "NETCOM\nzorunlu\n38700 ZORUNLU/ ZORUNLU\nVergi Dairesi: MERKEZ\nVKN: 9000068418\ne-FATURA\nÖzelleştirme No: TR1.2\nSAYIN\nSenaryo: TICARIFATURA\nKOÇAK PIRLANTA\nFatura Tipi: SATIS\nYıldırım Beyazıd mah. mevlana cad BAL AP\nFatura No: SND2024000000008\n04000 HAMUR/ AĞRI\nVergi Dairesi: AĞRI Fatura Tarihi: 18-03-2024\nVKN: 9000068418 Düzenleme Tarihi: 18-03-2024\nDüzenleme Saati: 08:51:49\nETTN: 38977a42-20c4-4a9c-9c27-eef261d9b4fd\nSıra İskonto İskonto KDV\nMal Hizmet Miktar Birim Fiyat KDV Tutarı Diğer Vergiler Mal Hizmet Tutarı\nNo Oranı Tutarı Oranı\n1 LENOVO PC 1 Adet 33.333,33333300 TL %5,00 1.666,67 TL %20,00 6.333,33 TL 31.666,67 TL\n2 HP BİLGİSAYAR 1 Adet 37.500,00000000 TL %5,00 1.875,00 TL %20,00 7.125,00 TL 35.625,00 TL\n3 SAMSUNG BİLGİSAYAR 1 Adet 41.666,66666700 TL %5,00 2.083,33 TL %20,00 7.916,67 TL 39.583,33 TL\nMal Hizmet Toplam Tutarı 112.500,00 TL\nToplam İskonto 5.625,00 TL\nHesaplanan KDV(%20) 21.375,00 TL\nVergiler Dahil Toplam Tutar 128.250,00 TL\nÖdenecek Tutar 128.250,00 TL\nSicil No:\nMersis No: 1616161616161616\nİşletme Merkezi: ZORUNLU\nYAZI İLE: YüzYirmiSekizBinİkiYüzElli TL\nÖdeme Notu: VADE TARİHİ: 2024-03-18 (PEŞİN)"
    },
    {
        "yapilandirilmis_veri": {
            "fatura_no": "TTT2025000000018",
            "fatura_tarihi": "24-07-2025",
            "duzenleme_saati": "13:36:00",
            "ettn": "11717a36-75f7-4df2-ab2f-247618685333",
            "mal_hizmet_toplam_tutari": "179.683,00 TL",
            "yazi_ile_tutar": "#Yüz Altmış Bir Bin Yedi Yüz On Dört",
            "para_birimi": "TL",
            "senaryo": "TEMELFATURA",
            "fatura_tipi_kod": "SATIS",
            "urun_kalemleri": []
        },
        "ham_metin": "UYUMSOFT BİLGİ SİSTEMLERİ VE TEKNOLOJİLERİ TİCARET\nANONİM ŞİRKETİ\n42000 Zincirlikuyu/ İstanbul\nTel: 1111111111111111111\nWeb Sitesi: www.uyumsoft.com.tr\nVergi Dairesi: 30 ağustos\nVKN: 9000068418\ne-FATURA\nÖzelleştirme No: TR1.2\nSenaryo: TEMELFATURA\nFatura Tipi: SATIS\nSAYIN\nFatura No: TTT2025000000018\nUyumsoft Bilgi Sistemleri Ve Teknolojileri Ticaret Anonim Şirketi\nILCE/ İstanbul Fatura Tarihi: 24-07-2025\nVKN: 9000068418 Düzenleme Tarihi: 24-07-2025\nDüzenleme Saati: 13:36:00\nETTN: 11717a36-75f7-4df2-ab2f-247618685333\nSıra İskonto İskonto KDV\nMal Hizmet Miktar Birim Fiyat KDV Tutarı Diğer Vergiler Mal Hizmet Tutarı\nNo Oranı Tutarı Oranı\n44.920,75\n1 teest2 1 Adet179.683,00000000 TL %25,00 %20,00 26.952,45 TL 134.762,25 TL\nTL\nMal Hizmet Toplam Tutarı 179.683,00 TL\nToplam İskonto 44.920,75 TL\nHesaplanan KDV(%20.00) 26.952,45 TL\nVergiler Dahil Toplam Tutar 161.714,70 TL\nÖdenecek Tutar 161.714,70 TL\nYalnız #Yüz Altmış Bir Bin Yedi Yüz On Dört Türk Lirası Yetmiş Kuruş#"
    },
    {
        "yapilandirilmis_veri": {
            "fatura_no": "CWF2023000000010",
            "fatura_tarihi": "18-05-2023",
            "ettn": "b71a16e5-8a5d-47f2-90ee-bb68de5b573b",
            "odenecek_tutar": "7",
            "mal_hizmet_toplam_tutari": "142.000,00 TL",
            "para_birimi": "TL",
            "senaryo": "TEMELFATURA",
            "fatura_tipi_kod": "SATIS",
            "alici_vergi_dairesi": "Istanbul",
            "urun_kalemleri": []
        },
        "ham_metin": "MARK'S TURKEY COMPANY\n1 MAIN STREET\n10000 KONAKPINAR/ Balikesir\nVergi Dairesi: Istanbul\nVKN: 9000068418\nSUBENO: MBR\nTICARETSICILNO: TRN9000068418\nMERSISNO: MER9000068418 e-FATURA\nSAYIN\nAKB SHIPPING COMPANY\nABC STREET AKBAL PLAZA KAT:3 NO:317\nÖzelleştirme No: TR1.2\n34440 KADIKOY/ Istanbul\nSenaryo: TEMELFATURA\nE-Posta: akn@akborg.com\nFatura Tipi: SATIS\nTel: +902163555555\nVergi Dairesi: KADIKOY Fatura No: CWF2023000000010\nVKN: 9000068418 Fatura Tarihi: 18-05-2023\nDüzenleme Tarihi: 18-05-2023\nETTN: b71a16e5-8a5d-47f2-90ee-bb68de5b573b\nSıra İskonto İskonto KDV\nMal Hizmet Miktar Birim Fiyat KDV Tutarı Diğer Vergiler Mal Hizmet Tutarı\nNo Oranı Tutarı Oranı\nDestination Documentation\n1 1 Adet 35.000,00000000 TL %18,00 6.300,00 TL 35.000,00 TL\nFee\nDestination - Other\n2 1 Adet 3.000,00000000 TL %18,00 540,00 TL 3.000,00 TL\nCharges\n3 Uluslararası Taşımacılık 1 Adet 4.000,00000000 TL %18,00 720,00 TL 4.000,00 TL\n4 Fuel Surcharge 1 Adet100.000,00000000 TL %18,00 18.000,00 TL 100.000,00 TL\nMal Hizmet Toplam Tutarı 142.000,00 TL\nToplam İskonto\nHesaplanan KDV(%18) 25.560,00 TL\nVergiler Dahil Toplam Tutar 167.560,00 TL\nÖdenecek Tutar 167.560,00 TL\nInvoiceDescription|S00004476\nBranchAddress|Şube Adresi: 1 MAIN STREET\nOrganizationContact|İlgili: AKN\nCurrencyToString|Yalnız yüzaltmışyedibinbeşyüzaltmış TRY\nInvoiceMessage|Please contact us within 7 days should there be any discrepancies.\nLocalTotalTax-18|142000.00,25560.00\nLocalLegalMoney-TaxExclusiveAmount|142000.00\nLocalLegalMoney-TaxInclusiveAmount|167560.00\nLocalLegalMoney-PayableAmount|167560.00\nHesap Açıklaması: BANK OF TURKEY"
    },
    {
        "yapilandirilmis_veri": {
            "fatura_no": "APU2024000000001",
            "fatura_tarihi": "07-09-2024",
            "duzenleme_saati": "00:00:00",
            "ettn": "20066b70-e7e3-40d8-badb-bb1874865121",
            "mal_hizmet_toplam_tutari": "157.764,18 TL",
            "para_birimi": "TL",
            "senaryo": "TEMELFATURA",
            "fatura_tipi_kod": "SATIS",
            "irsaliye_tarihi": "02-09-2024",
            "alici_vergi_dairesi": "BEYKOZ",
            "urun_kalemleri": []
        },
        "ham_metin": "PARILTIM END.TOPLU YEMEK HİZ.TUR.SAN.VE TİC.A.Ş.\nGÖZTEPE MAH. EKSEN SOK. NO:8/1 BEYKOZ/ İSTANBUL İstanbul\n34815 Beykoz/ İstanbul\nTel: 0216 465 96 66 Fax: 0216 465 97 17\nWeb Sitesi: www.pariltim-newrest.com\nE-Posta: muhasebe@pariltim-newrest.eu\nVergi Dairesi: BEYKOZ\nVKN: 9000068418\nTICARETSICILNO: 702892-0 e-FATURA\nMERSISNO: 0721038111300018\nSAYIN\nASTAŞ CENNET KOYU TATİL EVLERİ SİTE YÖNETİCİLİĞİ Özelleştirme No: TR1.2\nBARANSEL ÖZCAN\nSenaryo: TEMELFATURA\nGöltürkbükü Mah. 314 Sok. No:12/1\nFatura Tipi: SATIS\n48483 BODRUM / MUĞLA\nFatura No: APU2024000000001\nE-Posta: odik@mohg.com\nFatura Tarihi: 07-09-2024\nTel: 0252 311 26 20 Fax: 0252 311 26 20\nVergi Dairesi: BODRUM Düzenleme Tarihi: 07-09-2024\nVKN: 9000068418 Düzenleme Saati: 00:00:00\nİrsaliye Tarihi: 02-09-2024\nETTN: 20066b70-e7e3-40d8-badb-bb1874865121\nSıra İskonto İskonto KDV\nMal Hizmet Miktar Birim Fiyat KDV Tutarı Diğer Vergiler Mal Hizmet Tutarı\nNo Oranı Tutarı Oranı\nKAHVALTI-ASTAŞ CENNET\n1 350 Adet 83,20000000 TL %10,00 2.912,00 TL 29.120,00 TL\nKOYU\nÖĞLE YEMEĞİ-ASTAŞ\n1 497 Adet 125,52000000 TL %10,00 6.238,34 TL 62.383,44 TL\nCENNET KOYU\nAKŞAM YEMEĞİ-ASTAŞ\n1 496 Adet 125,52000000 TL %10,00 6.225,79 TL 62.257,92 TL\nCENNET KOYU\nGECE YEMEĞİ-ASTAŞ\n1 34 Adet 117,73000000 TL %10,00 400,28 TL 4.002,82 TL\nCENNET KOYU\nMal Hizmet Toplam Tutarı 157.764,18 TL\nToplam İskonto 0,00 TL\nHesaplanan GERÇEK USÜLDE KATMA\n15.776,42 TL\nDEĞER VERGİSİ(%10)\nVergiler Dahil Toplam Tutar 173.540,60 TL\nÖdenecek Tutar 173.540,60 TL\n1-7 EYLÜL LİMON BAHÇE SAYILARI\nyüz yetmiş üç bin beş yüz kırk türk lirası ve altmış kuruş\n#SEVKADRESI: BARANSEL ÖZCAN Göltürkbükü Mah. 314 Sok. No:12/1 BODRUM 48483 MUĞLA\n50.20.01 - Bodrum MM\nKonacık Mah. Gazderesi cad. No21-3 Bodrum/ Muğla Muğla Muğla 34000 EGE BÖLGE"
    },
    {
        "yapilandirilmis_veri": {
            "fatura_no": "PRT2024000003508",
            "fatura_tarihi": "07-09-2024",
            "duzenleme_saati": "00:00:00",
            "ettn": "f0a11577-5064-4039-a2a3-a233903f8d34",
            "mal_hizmet_toplam_tutari": "221.788,00 TL",
            "para_birimi": "TL",
            "senaryo": "TICARIFATURA",
            "fatura_tipi_kod": "SATIS",
            "irsaliye_tarihi": "01-09-2024",
            "alici_vergi_dairesi": "BEYKOZ",
            "urun_kalemleri": []
        },
        "ham_metin": "PARILTIM END.TOPLU YEMEK HİZ.TUR.SAN.VE TİC.A.Ş.\nGÖZTEPE MAH. EKSEN SOK. NO:8/1 BEYKOZ/ İSTANBUL İstanbul\n34815 Beykoz/ İstanbul\nTel: 0216 465 96 66 Fax: 0216 465 97 17\nWeb Sitesi: www.pariltim-newrest.com\nE-Posta: muhasebe@pariltim-newrest.eu\nVergi Dairesi: BEYKOZ\nVKN: 9000068418\nTICARETSICILNO: 702892-0 e-FATURA\nMERSISNO: 0721038111300018\nSAYIN\nBEŞER BALATACILIK SAN.VE TİC.A.Ş. Özelleştirme No: TR1.2\nBEŞER BALATACILIK SAN.VE TİC.A.Ş.\nSenaryo: TICARIFATURA\nANKARA CAD. NO: 309\nFatura Tipi: SATIS\n35080 BORNOVA / İZMİR\nFatura No: PRT2024000003508\nE-Posta: mustafa.guler@beser.com.tr\nFatura Tarihi: 07-09-2024\nTel: 0530 425 97 53\nVergi Dairesi: BORNOVA Düzenleme Tarihi: 07-09-2024\nVKN: 9000068418 Düzenleme Saati: 00:00:00\nİrsaliye Tarihi: 01-09-2024\nETTN: f0a11577-5064-4039-a2a3-a233903f8d34\nSıra İskonto İskonto KDV\nMal Hizmet Miktar Birim Fiyat KDV Tutarı Diğer Vergiler Mal Hizmet Tutarı\nNo Oranı Tutarı Oranı\nKAHVALTI-BEŞER\n1 14 Adet 92,00000000 TL %10,00 128,80 TL 1.288,00 TL\nBALATACILIK-İZMİR MM\nÖĞLE YEMEĞİ-BEŞER 1.375\n1 92,00000000 TL %10,00 12.650,00 TL 126.500,00 TL\nBALATACILIK-İZMİR MM Adet\nAKŞAM YEMEĞİ-BEŞER\n1 400 Adet 92,00000000 TL %10,00 3.680,00 TL 36.800,00 TL\nBALATACILIK-İZMİR MM\nAYRAN-BEŞER 3.300\n1 11,00000000 TL %10,00 3.630,00 TL 36.300,00 TL\nBALATACILIK-İZMİR MM Adet\nSODA-BEŞER 1.900\n1 11,00000000 TL %10,00 2.090,00 TL 20.900,00 TL\nBALATACILIK-İZMİR MM Adet\nMal Hizmet Toplam Tutarı 221.788,00 TL\nToplam İskonto 0,00 TL\nHesaplanan GERÇEK USÜLDE KATMA\n22.178,80 TL\nDEĞER VERGİSİ(%10)\nVergiler Dahil Toplam Tutar 243.966,80 TL\nÖdenecek Tutar 243.966,80 TL\n1-7.09 FATURASIDIR\niki yüz kırk üç bin dokuz yüz altmış altı türk lirası ve seksen kuruş\n#SEVKADRESI: BEŞER BALATACILIK SAN.VE TİC.A.Ş. ANKARA CAD. NO: 309 BORNOVA 35080 İZMİR\n50.30.02 - İzmir MM\nKemalpaşa Osb. 18. Sok No:132 Kemalpaşa/ İzmir İzmir İzmir 34000 EGE BÖLGE"
    },
    {
        "yapilandirilmis_veri": {
            "fatura_no": "EF02025000000012",
            "fatura_tarihi": "02-07-2025",
            "ettn": "000C29A5-2F18-1FD0-95E7-C5CCAA050DCB",
            "odenecek_tutar": "0090000089",
            "mal_hizmet_toplam_tutari": "74.630,00 TL",
            "para_birimi": "TL",
            "senaryo": "TICARIFATURA",
            "fatura_tipi_kod": "SATIS",
            "irsaliye_no": "0080000113",
            "irsaliye_tarihi": "02-07-2025",
            "alici_vergi_dairesi": "ÜSKÜDAR",
            "urun_kalemleri": []
        },
        "ham_metin": "Enoca Bilgi Teknolojileri\n34750 Merkez/ İSTANBUL\nTel: +90 850 221 73 54 Fax: 0 370 419 1054\nWeb Sitesi: www.enoca.com\nE-Posta: enoca@enoca.com\nVergi Dairesi: ÜSKÜDAR\nVKN: 9000068418\ne-FATURA\nÖzelleştirme No: TR1.2\nSenaryo: TICARIFATURA\nSAYIN\nFatura Tipi: SATIS\nUYUMSOFT BİLGİ SİSTEMLERİ VE TEKNOLOJİLE\nFatura No: EF02025000000012\nİSTANBUL No:10\nFatura Tarihi: 02-07-2025\n42000 İSTANBUL/ İstanbul\nVergi Dairesi: 30 AĞUSTOS Düzenleme Tarihi: 02-07-2025\nVKN: 9000068418 İrsaliye No: 0080000113\nİrsaliye Tarihi: 02-07-2025\nETTN: 000C29A5-2F18-1FD0-95E7-C5CCAA050DCB\nSıra İskonto İskonto KDV\nMal Hizmet Miktar Birim Fiyat KDV Tutarı Diğer Vergiler Mal Hizmet Tutarı\nNo Oranı Tutarı Oranı\n1 Çelik 5 Adet 291,00000000 TL %10,00 145,50 TL 1.455,00 TL\n2 Bakır 5 Adet 14.635,00000000 TL %20,00 14.635,00 TL 73.175,00 TL\nMal Hizmet Toplam Tutarı 74.630,00 TL\nToplam İskonto 0,00 TL\nHesaplanan KDV(%10.00) 145,50 TL\nHesaplanan KDV(%20.00) 14.635,00 TL\nVergiler Dahil Toplam Tutar 89.410,50 TL\nÖdenecek Tutar 89.410,50 TL\nYALNIZ SEKSENDOKUZBİNDÖRTYÜZON TRY ELLİ KR\nIDE:SAP Fatura No:0090000089"
    },
    {
        "yapilandirilmis_veri": {
            "fatura_no": "AKA2025000000005",
            "fatura_tarihi": "28-05-2025",
            "duzenleme_saati": "10:00:05",
            "ettn": "c8dd4798-42d4-4fdf-b165-1b8a24236b2d",
            "mal_hizmet_toplam_tutari": "75.000,00 TL",
            "para_birimi": "TL",
            "senaryo": "TEMELFATURA",
            "fatura_tipi_kod": "SATIS",
            "satici_adres": "1 uyumsoft Talas/ Kayseri E-Posta: dfsdf@ggh.gfgh",
            "alici_adres": "1 uyumsoft Talas/ Kayseri E-Posta: dfsdf@ggh.gfgh",
            "alici_vergi_dairesi": "daire",
            "urun_kalemleri": []
        },
        "ham_metin": "Netsim Yazılım A.Ş\nAdres 1 uyumsoft\nTalas/ Kayseri\nE-Posta: dfsdf@ggh.gfgh\nVergi Dairesi: daire\nVKN: 9000068418\ne-FATURA\nÖzelleştirme No: TR1.2\nSAYIN\nSenaryo: TEMELFATURA\nCari 4\nFatura Tipi: SATIS\nAdres 1\nFatura No: AKA2025000000005\n38280 TALAS/ KAYSERİ\nVergi Dairesi: daire Fatura Tarihi: 28-05-2025\nVKN: 9000068418 Düzenleme Tarihi: 28-05-2025\nDüzenleme Saati: 10:00:05\nETTN: c8dd4798-42d4-4fdf-b165-1b8a24236b2d\nSıra İskonto İskonto KDV\nMal Hizmet Miktar Birim Fiyat KDV Tutarı Diğer Vergiler Mal Hizmet Tutarı\nNo Oranı Tutarı Oranı\n1 CİHAZ-1 1 Adet 75.000,00000000 TL %20,00 15.000,00 TL 75.000,00 TL\nMal Hizmet Toplam Tutarı 75.000,00 TL\nToplam İskonto 0,00 TL\nHesaplanan KDV(%20) 15.000,00 TL\nVergiler Dahil Toplam Tutar 90.000,00 TL\nÖdenecek Tutar 90.000,00 TL\nSicil No: 150\nMersis No: 1111111111111111\nİşletme Merkezi: Kayseri\nYAZI İLE: DoksanBin TL\nÖdeme Notu: VADE TARİHİ: 2025-05-28 (-- --)"
    },
    {
        "yapilandirilmis_veri": {
            "fatura_no": "GCE2025000000020",
            "fatura_tarihi": "01-07-2025",
            "duzenleme_saati": "21:54:00",
            "ettn": "9f30d2e9-2ce3-4938-ad38-f34256b1c0f3",
            "mal_hizmet_toplam_tutari": "110.599,00 TL",
            "para_birimi": "TL",
            "senaryo": "TICARIFATURA",
            "fatura_tipi_kod": "SATIS",
            "alici_vergi_dairesi": "İlyasbey",
            "urun_kalemleri": []
        },
        "ham_metin": "GÜLTEKIN ÇATALTEPE\nGÜLTEKIN ÇATALTEPE\nOSMAN YILMAZ MAH. 608/4. SK. NO: 4 IÇ KAPI NO: 15 GEBZE/\nKOCAELI\nGebze/ Kocaeli\nTel: 5334262729\nE-Posta: gultekin.cataltepe@pargesoft.com\nVergi Dairesi: İlyasbey\ne-FATURA\nVKN: 9000068418\nÖzelleştirme No: TR1.2\nSAYIN\nSenaryo: TICARIFATURA\nTEST ANONİM ŞİRKETİ\nFatura Tipi: SATIS\nORTAKÖY MAH.\nFatura No: GCE2025000000020\nSilivri/ İstanbul\nVergi Dairesi: YENİKAPI VERGİ DAİRESİ MÜD. Fatura Tarihi: 01-07-2025\nVKN: 9000068418 Düzenleme Tarihi: 01-07-2025\nDüzenleme Saati: 21:54:00\nETTN: 9f30d2e9-2ce3-4938-ad38-f34256b1c0f3\nSıra İskonto İskonto KDV\nMal Hizmet Miktar Birim Fiyat KDV Tutarı Diğer Vergiler Mal Hizmet Tutarı\nNo Oranı Tutarı Oranı\n1 MAYIS AYI HİZMET BEDELİ 1 Adet110.599,00000000 TL %20,00 22.119,80 TL 110.599,00 TL\nMal Hizmet Toplam Tutarı 110.599,00 TL\nToplam İskonto 0,00 TL\nHesaplanan KDV GERCEK(%20) 22.119,80 TL\nVergiler Dahil Toplam Tutar 132.718,80 TL\nÖdenecek Tutar 132.718,80 TL\nYazı ile: # Yüz Otuz İki Bin Yedi Yüz On Sekiz TL Seksen KRŞ #\nPO-0003699008"
    },
    {
        "yapilandirilmis_veri": {
            "fatura_no": "FMH2025000000006",
            "fatura_tarihi": "25-06-2025",
            "duzenleme_saati": "10:24:36",
            "ettn": "04d0ef8a-831f-4d4e-87ae-7701d72c999d",
            "siparis_no": "2361001844",
            "odenecek_tutar": "33.16290",
            "mal_hizmet_toplam_tutari": "200.000,00 TL",
            "para_birimi": "TL",
            "fatura_tipi_kod": "SATIS",
            "irsaliye_no": "IFM2025000000021",
            "irsaliye_tarihi": "25-06-2025",
            "alici_vergi_dairesi": "B",
            "urun_kalemleri": []
        },
        "ham_metin": "FRESENİUS MEDİKAL HİZMETLER ANONİM ŞİRKETİ\nMERKEZ: Rüzgarlı Bahçe Mah. Cumhuriyet Cad. No:39 Kat:7\nKavacık BEYKOZ/ISTANBUL ANTALYA MUMESSILLIK ECZA DEPOSU\nŞUBESİ: AOSB 1.Kısım Mah.8.Cadde No:3\nDÖŞEMEALTI/ ANTALYA\nTel: 0242 2594092 Fax: 0242 2594094\nWeb Sitesi: www.freseniusmedicalcare.com.tr\nE-Posta: info.turkey@freseniusmedicalcare.com\nVergi Dairesi: B.MUKELLEFLER\nVKN: 9000068418 e-FATURA\nTICARETSICILNO: 40368\nMERSISNO: 324000887200015\nSAYIN Özelleştirme No: TR1.2\nT.C. İST.VAL. İL SAĞLIK MÜDÜRLÜĞÜ DR. LÜTFİ KIRDAR ŞEHİR Senaryo: ILAC_TIBBICIHAZ\nHAST.GNL.BUT\nFatura Tipi: SATIS\nŞEMSİ DENİZER CD.\nFatura No: FMH2025000000006\n34865 CEVİZLİ MH. KARTAL/ İSTANBUL\nFatura Tarihi: 25-06-2025\nE-Posta: defaultpk@muhasebat.gov.tr\nDüzenleme Tarihi: 25-06-2025\nTel: 2164413900\nVergi Dairesi: KARTAL Düzenleme Saati: 10:24:36\nVKN: 9000068418 İrsaliye No: IFM2025000000021\nİrsaliye Tarihi: 25-06-2025\nETTN: 04d0ef8a-831f-4d4e-87ae-7701d72c999d\nSıra İskonto İskonto KDV\nMal Hizmet Miktar Birim Fiyat KDV Tutarı Diğer Vergiler Mal Hizmet Tutarı\nNo Oranı Tutarı Oranı\n1 Aqua RO MOBILE 1 Adet200.000,00000000 TL %10,00 20.000,00 TL 200.000,00 TL\nMal Hizmet Toplam Tutarı 200.000,00 TL\nToplam İskonto\nHesaplanan Satış vergisi(%10.00) 20.000,00 TL\nVergiler Dahil Toplam Tutar 220.000,00 TL\nÖdenecek Tutar 220.000,00 TL\nYalnız İKİYÜZYİRMİBİN LİRA\nTCMB Efektif Satış Kuru: 33.16290\nSAP fatura no: 0188147349\nSAP sipariş no: 2361001844\nMüş. No: 0920175949\nFİRMA TANIMLAYICI NO: 2667269040084\nSevk Adresi: T.C. İST.VAL. İL SAĞLIK MÜDÜRLÜĞÜ DR. LÜTFİ KIRDAR ŞEHİR HAST.GNL.BUT ŞEMSİ DENİZER CD. CEVİZLİ MH. KARTAL İSTANBUL\nVade: 90 Gün 23.09.2025 ."
    },
    {
        "yapilandirilmis_veri": {
            "fatura_no": "FRE2025000000001",
            "fatura_tarihi": "18-06-2025",
            "duzenleme_saati": "12:39:58",
            "ettn": "adb3181c-2246-4b34-918e-44517ff474f7",
            "siparis_no": "2361001642",
            "odenecek_tutar": "33.16290",
            "mal_hizmet_toplam_tutari": "144.000,00 TL",
            "para_birimi": "TL",
            "fatura_tipi_kod": "SATIS",
            "irsaliye_no": "IFM2025000000013",
            "irsaliye_tarihi": "18-06-2025",
            "alici_vergi_dairesi": "B",
            "urun_kalemleri": []
        },
        "ham_metin": "FRESENİUS MEDİKAL HİZMETLER ANONİM ŞİRKETİ\nMERKEZ: Rüzgarlı Bahçe Mah. Cumhuriyet Cad. No:39 Kat:7\nKavacık BEYKOZ/ISTANBUL ANTALYA MUMESSILLIK ECZA DEPOSU\nŞUBESİ: AOSB 1.Kısım Mah.8.Cadde No:3\nDÖŞEMEALTI/ ANTALYA\nTel: 0242 2594092 Fax: 0242 2594094\nWeb Sitesi: www.freseniusmedicalcare.com.tr\nE-Posta: info.turkey@freseniusmedicalcare.com\nVergi Dairesi: B.MUKELLEFLER\nVKN: 9000068418 e-FATURA\nTICARETSICILNO: 40368\nMERSISNO: 324000887200015\nSAYIN Özelleştirme No: TR1.2\nT.C. İST.VAL. İL SAĞLIK MÜDÜRLÜĞÜ DR. LÜTFİ KIRDAR ŞEHİR Senaryo: ILAC_TIBBICIHAZ\nHAST.GNL.BUT\nFatura Tipi: SATIS\nŞEMSİ DENİZER CD.\nFatura No: FRE2025000000001\n34865 CEVİZLİ MH. KARTAL/ İSTANBUL\nFatura Tarihi: 18-06-2025\nE-Posta: defaultpk@muhasebat.gov.tr\nDüzenleme Tarihi: 18-06-2025\nTel: 2164413900\nVergi Dairesi: KARTAL Düzenleme Saati: 12:39:58\nVKN: 9000068418 İrsaliye No: IFM2025000000013\nİrsaliye Tarihi: 18-06-2025\nETTN: adb3181c-2246-4b34-918e-44517ff474f7\nSıra İskonto İskonto KDV\nMal Hizmet Miktar Birim Fiyat KDV Tutarı Diğer Vergiler Mal Hizmet Tutarı\nNo Oranı Tutarı Oranı\n1 FX 60 classix 120 Adet 1.200,00000000 TL %10,00 14.400,00 TL 144.000,00 TL\nMal Hizmet Toplam Tutarı 144.000,00 TL\nToplam İskonto\nHesaplanan Satış vergisi(%10.00) 14.400,00 TL\nVergiler Dahil Toplam Tutar 158.400,00 TL\nÖdenecek Tutar 158.400,00 TL\nYalnız YÜZ ELLİSEKİZBİNDÖRTYÜZ LİRA\nTCMB Efektif Satış Kuru: 33.16290\nSAP fatura no: 0188147341\nSAP sipariş no: 2361001642\nMüş. No: 0920175949\nFİRMA TANIMLAYICI NO: 2667269040084\nSevk Adresi: T.C. İST.VAL. İL SAĞLIK MÜDÜRLÜĞÜ DR. LÜTFİ KIRDAR ŞEHİR HAST.GNL.BUT ŞEMSİ DENİZER CD. CEVİZLİ MH. KARTAL İSTANBUL\nVade: 90 Gün 16.09.2025 .\n1 . Satır - Seri No.: E1XI05120 UBB: 4039361068257 Kodu: F00002386 Skt: 2026-08-31 Adet: 120 SUT: NF1007 DMO Ürün No: SM10038"
    },
    {
        "yapilandirilmis_veri": {
            "fatura_no": "SEM2025000000201",
            "fatura_tarihi": "25-08-2025",
            "duzenleme_saati": "16:32:11",
            "ettn": "7d481f48-0558-420e-bd89-d7a46c3f7396",
            "siparis_no": "Sipariş",
            "mal_hizmet_toplam_tutari": "125.000,00 TL",
            "para_birimi": "TL",
            "senaryo": "TICARIFATURA",
            "fatura_tipi_kod": "SATIS",
            "siparis_tarihi": "25-08-2025",
            "satici_adres": "No : 123/A Maltepe/ İstanbul",
            "alici_adres": "No : 123/A Maltepe/ İstanbul",
            "alici_vergi_dairesi": "Kozyatağı",
            "urun_kalemleri": []
        },
        "ham_metin": "Gerçek Oto Lastik Sanayi Tic. Ltd. Şti.\nÖrnek Adres No : 123/A\nMaltepe/ İstanbul\nVergi Dairesi: Kozyatağı\nVKN: 9000068418\ne-FATURA\nÖzelleştirme No: TR1.2\nSenaryo: TICARIFATURA\nSAYIN\nFatura Tipi: SATIS\nFatura Testi Müşterisi\nFatura No: SEM2025000000201\nDeneme Adresi\nFatura Tarihi: 25-08-2025\nAtaşehir/ İstanbul\nDüzenleme Tarihi: 25-08-2025\nTel: (435) 353-5353\nVergi Dairesi: Kozyatağı Düzenleme Saati: 16:32:11\nVKN: 9000068418 Sipariş No: -\nSipariş Tarihi: 25-08-2025\nETTN: 7d481f48-0558-420e-bd89-d7a46c3f7396\nSıra İskonto İskonto KDV\nMal Hizmet Miktar Birim Fiyat KDV Tutarı Diğer Vergiler Mal Hizmet Tutarı\nNo Oranı Tutarı Oranı\nLT245/75R16 120/116Q\n1 4 Adet 6.458,33000000 TL 0,00 TL %20,00 5.166,68 TL 25.833,32 TL\nDYNAPRO MT2 RT05\n275/50R20 113W XL EAG\n2 4 Adet 8.750,00000000 TL 0,00 TL %20,00 7.000,00 TL 35.000,00 TL\nF1 ASY 6 FP\nDY808 818 5112 ET40 BD\n3 4 Adet 4.375,00000000 TL 0,00 TL %20,00 3.500,00 TL 17.500,00 TL\n66,45\nDY808 818 5112 ET40 BD\n4 4 Adet 5.416,67000000 TL 0,00 TL %20,00 4.333,32 TL 21.666,68 TL\n66,45 20 İNÇ\n205/55R16 91V N BLUE S\n5 4 Adet 2.291,67000000 TL 0,00 TL %20,00 1.833,32 TL 9.166,68 TL\nVW / SEAT / AUD\nEagle F1 Asymmetric 6\n6 4 Adet 3.958,33000000 TL 0,00 TL %20,00 3.166,68 TL 15.833,32 TL\n225/40R18 92Y XL FP\nMal Hizmet Toplam Tutarı 125.000,00 TL\nToplam İskonto 0,00 TL\nHesaplanan KDV(%20) 25.000,00 TL\nVergiler Dahil Toplam Tutar 150.000,00 TL\nÖdenecek Tutar 150.000,00 TL\n#yüzellibinTL#\n.\nFatura Notu:"
    },
    {
        "yapilandirilmis_veri": {
            "fatura_no": "FRE2025000000002",
            "fatura_tarihi": "18-06-2025",
            "duzenleme_saati": "10:45:34",
            "ettn": "f2f40d65-5a3e-4d1c-bce0-043f69a78724",
            "siparis_no": "2361001645",
            "odenecek_tutar": "33.16290",
            "mal_hizmet_toplam_tutari": "180.000,00 TL",
            "para_birimi": "TL",
            "fatura_tipi_kod": "SATIS",
            "irsaliye_no": "IFM2025000000014",
            "irsaliye_tarihi": "18-06-2025",
            "alici_vergi_dairesi": "B",
            "urun_kalemleri": []
        },
        "ham_metin": "FRESENİUS MEDİKAL HİZMETLER ANONİM ŞİRKETİ\nMERKEZ: Rüzgarlı Bahçe Mah. Cumhuriyet Cad. No:39 Kat:7\nKavacık BEYKOZ/ISTANBUL ANTALYA MUMESSILLIK ECZA DEPOSU\nŞUBESİ: AOSB 1.Kısım Mah.8.Cadde No:3\nDÖŞEMEALTI/ ANTALYA\nTel: 0242 2594092 Fax: 0242 2594094\nWeb Sitesi: www.freseniusmedicalcare.com.tr\nE-Posta: info.turkey@freseniusmedicalcare.com\nVergi Dairesi: B.MUKELLEFLER\nVKN: 9000068418 e-FATURA\nTICARETSICILNO: 40368\nMERSISNO: 324000887200015\nSAYIN Özelleştirme No: TR1.2\nT.C. İST.VAL. İL SAĞLIK MÜDÜRLÜĞÜ DR. LÜTFİ KIRDAR ŞEHİR Senaryo: ILAC_TIBBICIHAZ\nHAST.GNL.BUT\nFatura Tipi: SATIS\nŞEMSİ DENİZER CD.\nFatura No: FRE2025000000002\n34865 CEVİZLİ MH. KARTAL/ İSTANBUL\nFatura Tarihi: 18-06-2025\nE-Posta: defaultpk@muhasebat.gov.tr\nDüzenleme Tarihi: 18-06-2025\nTel: 2164413900\nVergi Dairesi: KARTAL Düzenleme Saati: 10:45:34\nVKN: 9000068418 İrsaliye No: IFM2025000000014\nİrsaliye Tarihi: 18-06-2025\nETTN: f2f40d65-5a3e-4d1c-bce0-043f69a78724\nSıra İskonto İskonto KDV\nMal Hizmet Miktar Birim Fiyat KDV Tutarı Diğer Vergiler Mal Hizmet Tutarı\nNo Oranı Tutarı Oranı\n4008S classix BASIC\n1 1 Adet180.000,00000000 TL %10,00 18.000,00 TL 180.000,00 TL\nVERSION\nMal Hizmet Toplam Tutarı 180.000,00 TL\nToplam İskonto\nHesaplanan Satış vergisi(%10.00) 18.000,00 TL\nVergiler Dahil Toplam Tutar 198.000,00 TL\nÖdenecek Tutar 198.000,00 TL\nYalnız YÜZ DOKSANSEKİZBİN LİRA\nTCMB Efektif Satış Kuru: 33.16290\nSAP fatura no: 0188147342\nSAP sipariş no: 2361001645\nMüş. No: 0920175949\nFİRMA TANIMLAYICI NO: 2667269040084\nSevk Adresi: T.C. İST.VAL. İL SAĞLIK MÜDÜRLÜĞÜ DR. LÜTFİ KIRDAR ŞEHİR HAST.GNL.BUT ŞEMSİ DENİZER CD. CEVİZLİ MH. KARTAL İSTANBUL\nVade: 90 Gün 16.09.2025 ."
    },
    {
        "yapilandirilmis_veri": {
            "fatura_no": "MNT2023000000035",
            "fatura_tarihi": "30-03-2023",
            "duzenleme_saati": "14:56:00",
            "ettn": "dd316eb3-4c29-437a-8770-83db57816bc6",
            "mal_hizmet_toplam_tutari": "84.745,76 TL",
            "yazi_ile_tutar": "#Yüz Altmış Dokuz Bin Dokuz Yüz Doksan Dokuz",
            "para_birimi": "TL",
            "senaryo": "TICARIFATURA",
            "fatura_tipi_kod": "SATIS",
            "alici_vergi_dairesi": "test",
            "urun_kalemleri": []
        },
        "ham_metin": "UYUMSOFT BİLGİ SİSTEMLERİ VE TEKNOLOJİLERİ TİCARET\nANONİM ŞİRKETİ\nTel: test@test.com Fax: 5\nWeb Sitesi: http://www.test.com\nE-Posta: test@test.com\nVergi Dairesi: test3\nVKN: 9000068418\nTICARETSICILNO: 12345f\ne-FATURA\nMERSISNO: 11111111111111\nÖzelleştirme No: TR1.2\nSenaryo: TICARIFATURA\nFatura Tipi: SATIS\nSAYIN\nFatura No: MNT2023000000035\nE-fatura Test Carisi\nÜsküdar/ İstanbul Fatura Tarihi: 30-03-2023\nVKN: 9000068418 Düzenleme Tarihi: 30-03-2023\nDüzenleme Saati: 14:56:00\nETTN: dd316eb3-4c29-437a-8770-83db57816bc6\nSıra İskonto İskonto KDV\nMal Hizmet Miktar Birim Fiyat KDV Tutarı Diğer Vergiler Mal Hizmet Tutarı\nNo Oranı Tutarı Oranı\nSTİLO POŞET DOSYA ÖTV 4.LİSTE\n1 1 Adet 84.745,76000000 TL %18,00 25.932,20 TL 84.745,76 TL\n100'lü (%70,00)=59.322,03 TL\nMal Hizmet Toplam Tutarı 84.745,76 TL\nToplam İskonto 0,00 TL\nHesaplanan KDV(%18.00) 25.932,20 TL\nHesaplanan ÖTV 4.LİSTE(%70.000) 59.322,03 TL\nVergiler Dahil Toplam Tutar 169.999,99 TL\nÖdenecek Tutar 169.999,99 TL\nYalnız #Yüz Altmış Dokuz Bin Dokuz Yüz Doksan Dokuz Türk Lirası Doksan Dokuz Kuruş#"
    },
    {
        "yapilandirilmis_veri": {
            "fatura_no": "RSE2023000000171",
            "fatura_tarihi": "29-04-2023",
            "duzenleme_saati": "11:20:00",
            "ettn": "17b94a76-362a-40f3-a8a8-e8f9a421ec29",
            "siparis_no": "10",
            "mal_hizmet_toplam_tutari": "80.000,00 TL",
            "yazi_ile_tutar": "#Doksan Dört Bin Dört Yüz",
            "para_birimi": "TL",
            "senaryo": "TEMELFATURA",
            "fatura_tipi_kod": "SATIS",
            "siparis_tarihi": "29-04-2023",
            "alici_vergi_dairesi": "test",
            "urun_kalemleri": []
        },
        "ham_metin": "UYUMSOFT BİLGİ SİSTEMLERİ VE TEKNOLOJİLERİ TİCARET\nANONİM ŞİRKETİ\nTel: test@test.com Fax: 5\nWeb Sitesi: http://www.test.com\nE-Posta: test@test.com\nVergi Dairesi: test3\nVKN: 9000068418\nTICARETSICILNO: 12345f\ne-FATURA\nMERSISNO: 11111111111111\nÖzelleştirme No: TR1.2\nSenaryo: TEMELFATURA\nFatura Tipi: SATIS\nFatura No: RSE2023000000171\nFatura Tarihi: 29-04-2023\nSAYIN\nDüzenleme Tarihi: 29-04-2023\nUyumsoft Bilgi Sistem.ve Tekno.Tic.A.Ş.\nYENİŞEHİR/ İstanbul Düzenleme Saati: 11:20:00\nVKN: 9000068418 Sipariş No: 10\nSipariş Tarihi: 29-04-2023\nETTN: 17b94a76-362a-40f3-a8a8-e8f9a421ec29\nSıra İskonto İskonto KDV\nMal Hizmet Miktar Birim Fiyat KDV Tutarı Diğer Vergiler Mal Hizmet Tutarı\nNo Oranı Tutarı Oranı\n1 BİLGİSAYAR 10 Adet 8.000,00000000 TL %18,00 14.400,00 TL 80.000,00 TL\nMal Hizmet Toplam Tutarı 80.000,00 TL\nToplam İskonto 0,00 TL\nHesaplanan KDV(%18.00) 14.400,00 TL\nVergiler Dahil Toplam Tutar 94.400,00 TL\nÖdenecek Tutar 94.400,00 TL\nYalnız #Doksan Dört Bin Dört Yüz Türk Lirası#"
    },
    {
        "yapilandirilmis_veri": {
            "fatura_no": "PRT2024000003547",
            "fatura_tarihi": "14-09-2024",
            "duzenleme_saati": "00:00:01",
            "ettn": "909e48cc-741e-4762-ae77-e53435210196",
            "mal_hizmet_toplam_tutari": "206.140,00 TL",
            "para_birimi": "TL",
            "senaryo": "TICARIFATURA",
            "fatura_tipi_kod": "SATIS",
            "irsaliye_tarihi": "08-09-2024",
            "alici_vergi_dairesi": "BEYKOZ",
            "urun_kalemleri": []
        },
        "ham_metin": "PARILTIM END.TOPLU YEMEK HİZ.TUR.SAN.VE TİC.A.Ş.\nGÖZTEPE MAH. EKSEN SOK. NO:8/1 BEYKOZ/ İSTANBUL İstanbul\n34815 Beykoz/ İstanbul\nTel: 0216 465 96 66 Fax: 0216 465 97 17\nWeb Sitesi: www.pariltim-newrest.com\nE-Posta: muhasebe@pariltim-newrest.eu\nVergi Dairesi: BEYKOZ\nVKN: 9000068418\nTICARETSICILNO: 702892-0 e-FATURA\nMERSISNO: 0721038111300018\nSAYIN\nSOA TOPLU YEMEK ÜRETİM VE SERVİS A.Ş. Özelleştirme No: TR1.2\nSOA TOPLU YEMEK ÜRETİM VE SERVİS A.Ş.\nSenaryo: TICARIFATURA\nÇaybaşı Mahallesi Aydın Caddesi No:51 35880 Torbalı İzmir\nFatura Tipi: SATIS\n35880 Torbalı / İZMİR\nFatura No: PRT2024000003547\nE-Posta: goktug.akishalioglu@soa.com.tr\nFatura Tarihi: 14-09-2024\nTel: 0530 763 15 49 Fax: 0530 763 15 49\nVergi Dairesi: KOZYATAĞI Düzenleme Tarihi: 14-09-2024\nVKN: 9000068418 Düzenleme Saati: 00:00:01\nİrsaliye Tarihi: 08-09-2024\nETTN: 909e48cc-741e-4762-ae77-e53435210196\nSıra İskonto İskonto KDV\nMal Hizmet Miktar Birim Fiyat KDV Tutarı Diğer Vergiler Mal Hizmet Tutarı\nNo Oranı Tutarı Oranı\n1.245\n1 ÖĞLE YEMEĞİ-SOA YEMEK 92,00000000 TL %10,00 11.454,00 TL 114.540,00 TL\nAdet\nAKŞAM YEMEĞİ-SOA\n1 775 Adet 92,00000000 TL %10,00 7.130,00 TL 71.300,00 TL\nYEMEK\n1 SOA -POĞAÇA BEDELİ- 355 Adet 10,00000000 TL %10,00 355,00 TL 3.550,00 TL\nÇORBA BEDELİ-SOA\n1 355 Adet 10,00000000 TL %10,00 355,00 TL 3.550,00 TL\nYEMEK\nSICAK KUMANYA-SOA\n1 220 Adet 60,00000000 TL %10,00 1.320,00 TL 13.200,00 TL\nYEMEK\nMal Hizmet Toplam Tutarı 206.140,00 TL\nToplam İskonto 0,00 TL\nHesaplanan GERÇEK USÜLDE KATMA\n20.614,00 TL\nDEĞER VERGİSİ(%10)\nVergiler Dahil Toplam Tutar 226.754,00 TL\nÖdenecek Tutar 226.754,00 TL\niki yüz yirmi altı bin yedi yüz elli dört türk lirası\n#SEVKADRESI: SOA TOPLU YEMEK ÜRETİM VE SERVİS A.Ş. Çaybaşı Mahallesi Aydın Caddesi No:51 35880 Torbalı İzmir Torbalı 35880 İZMİR\n50.30.02 - İzmir MM\nKemalpaşa Osb. 18. Sok No:132 Kemalpaşa/ İzmir İzmir İzmir 34000 EGE BÖLGE"
    },
    {
        "yapilandirilmis_veri": {
            "fatura_no": "PRT2024000003551",
            "fatura_tarihi": "14-09-2024",
            "duzenleme_saati": "00:00:01",
            "ettn": "6b1898ee-468b-4614-b032-38d088cf5832",
            "mal_hizmet_toplam_tutari": "206.140,00 TL",
            "para_birimi": "TL",
            "senaryo": "TEMELFATURA",
            "fatura_tipi_kod": "SATIS",
            "irsaliye_tarihi": "08-09-2024",
            "alici_vergi_dairesi": "BEYKOZ",
            "urun_kalemleri": []
        },
        "ham_metin": "PARILTIM END.TOPLU YEMEK HİZ.TUR.SAN.VE TİC.A.Ş.\nMuhasebe\nGÖZTEPE MAH. EKSEN SOK. NO:8/1 BEYKOZ/ İSTANBUL İstanbul\n34815 Beykoz/ İstanbul\nTel: 0216 465 96 66 Fax: 0216 465 97 17\nWeb Sitesi: www.pariltim-newrest.com\nE-Posta: muhasebe@pariltim-newrest.eu\nVergi Dairesi: BEYKOZ\nVKN: 9000068418\ne-FATURA\nTICARETSICILNO: 702892-0\nMERSISNO: 0721038111300018\nSAYIN\nSOA TOPLU YEMEK ÜRETİM VE SERVİS A.Ş. Özelleştirme No: TR1.2\nSOA TOPLU YEMEK ÜRETİM VE SERVİS A.Ş.\nSenaryo: TEMELFATURA\nÇaybaşı Mahallesi Aydın Caddesi No:51 35880 Torbalı İzmir\nFatura Tipi: SATIS\n35880 Torbalı / İZMİR\nFatura No: PRT2024000003551\nE-Posta: goktug.akishalioglu@soa.com.tr\nFatura Tarihi: 14-09-2024\nTel: 0530 763 15 49 Fax: 0530 763 15 49\nVergi Dairesi: KOZYATAĞI Düzenleme Tarihi: 14-09-2024\nVKN: 9000068418 Düzenleme Saati: 00:00:01\nİrsaliye Tarihi: 08-09-2024\nETTN: 6b1898ee-468b-4614-b032-38d088cf5832\nSıra İskonto İskonto KDV\nMal Hizmet Miktar Birim Fiyat KDV Tutarı Diğer Vergiler Mal Hizmet Tutarı\nNo Oranı Tutarı Oranı\n1.245\n1 ÖĞLE YEMEĞİ-SOA YEMEK 92,00000000 TL %10,00 11.454,00 TL 114.540,00 TL\nAdet\nAKŞAM YEMEĞİ-SOA\n2 775 Adet 92,00000000 TL %10,00 7.130,00 TL 71.300,00 TL\nYEMEK\n3 SOA -POĞAÇA BEDELİ- 355 Adet 10,00000000 TL %10,00 355,00 TL 3.550,00 TL\nÇORBA BEDELİ-SOA\n4 355 Adet 10,00000000 TL %10,00 355,00 TL 3.550,00 TL\nYEMEK\nSICAK KUMANYA-SOA\n5 220 Adet 60,00000000 TL %10,00 1.320,00 TL 13.200,00 TL\nYEMEK\nMal Hizmet Toplam Tutarı 206.140,00 TL\nToplam İskonto 0,00 TL\nHesaplanan GERÇEK USÜLDE KATMA\n20.614,00 TL\nDEĞER VERGİSİ(%10)\nVergiler Dahil Toplam Tutar 226.754,00 TL\nÖdenecek Tutar 226.754,00 TL\niki yüz yirmi altı bin yedi yüz elli dört türk lirası\n#SEVKADRESI: SOA TOPLU YEMEK ÜRETİM VE SERVİS A.Ş. Çaybaşı Mahallesi Aydın Caddesi No:51 35880 Torbalı İzmir Torbalı 35880 İZMİR\n50.30.02 - İzmir MM\nKemalpaşa Osb. 18. Sok No:132 Kemalpaşa/ İzmir İzmir İzmir 34000 EGE BÖLGE"
    },
    {
        "yapilandirilmis_veri": {
            "fatura_no": "PRT2024000003502",
            "fatura_tarihi": "07-09-2024",
            "duzenleme_saati": "00:00:00",
            "ettn": "7550c524-79b1-44eb-8429-cd3b74d80280",
            "mal_hizmet_toplam_tutari": "231.353,50 TL",
            "para_birimi": "TL",
            "senaryo": "TEMELFATURA",
            "fatura_tipi_kod": "SATIS",
            "irsaliye_tarihi": "01-09-2024",
            "alici_vergi_dairesi": "BEYKOZ",
            "urun_kalemleri": []
        },
        "ham_metin": "PARILTIM END.TOPLU YEMEK HİZ.TUR.SAN.VE TİC.A.Ş.\nGÖZTEPE MAH. EKSEN SOK. NO:8/1 BEYKOZ/ İSTANBUL İstanbul\n34815 Beykoz/ İstanbul\nTel: 0216 465 96 66 Fax: 0216 465 97 17\nWeb Sitesi: www.pariltim-newrest.com\nE-Posta: muhasebe@pariltim-newrest.eu\nVergi Dairesi: BEYKOZ\nVKN: 9000068418\nTICARETSICILNO: 702892-0 e-FATURA\nMERSISNO: 0721038111300018\nSAYIN\nAKFEN TURİZM YATIRIMLARI VE İŞLETMECİLİK A.Ş. Özelleştirme No: TR1.2\nAKFEN TURİZM YATIRIMLARI VE İŞLETMECİLİK A.Ş.\nSenaryo: TEMELFATURA\nKOZA CAD NO:2 GOP ÇANKAYA/ANKARA\nFatura Tipi: SATIS\n06700 ÇANKAYA / ANKARA\nFatura No: PRT2024000003502\nE-Posta: Muhtur@akfen.com.tr\nFatura Tarihi: 07-09-2024\nTel: 312 441 42 11 Fax: 312 441 42 11\nVergi Dairesi: CUMHURİYET Düzenleme Tarihi: 07-09-2024\nVKN: 9000068418 Düzenleme Saati: 00:00:00\nİrsaliye Tarihi: 01-09-2024\nETTN: 7550c524-79b1-44eb-8429-cd3b74d80280\nSıra İskonto İskonto KDV\nMal Hizmet Miktar Birim Fiyat KDV Tutarı Diğer Vergiler Mal Hizmet Tutarı\nNo Oranı Tutarı Oranı\nKAHVALTI- AKFEN TURİZM\n1 757 Adet 91,67000000 TL %10,00 6.939,42 TL 69.394,19 TL\nLOFT OTEL (BODRUM MM)\nKUMANYA- AKFEN TURİZM\n1 273 Adet 91,67000000 TL %10,00 2.502,59 TL 25.025,91 TL\nLOFT OTEL (BODRUM MM)\nÖĞLE YEMEĞİ-AKFEN\n1 TURİZM LOFT OTEL 505 Adet 121,18000000 TL %10,00 6.119,59 TL 61.195,90 TL\n(BODRUM MM)\nAKŞAM YEMEĞİ- AKFEN\n1 TURİZM LOFT OTEL 625 Adet 121,18000000 TL %10,00 7.573,75 TL 75.737,50 TL\n(BODRUM MM)\nMal Hizmet Toplam Tutarı 231.353,50 TL\nToplam İskonto 0,00 TL\nHesaplanan GERÇEK USÜLDE KATMA\n23.135,35 TL\nDEĞER VERGİSİ(%10)\nVergiler Dahil Toplam Tutar 254.488,85 TL\nÖdenecek Tutar 254.488,85 TL\n1-7 EYLÜL LOFT YEMEK SAYILARI.\niki yüz elli dört bin dört yüz seksen sekiz türk lirası ve seksen beş kuruş\n#SEVKADRESI: Akfen Sevk Adresi GÖLKÖY MAH.325.SOKAK NO:7 BODRUM/MUĞLA BODRUM 48400 MUĞLA\n50.20.01 - Bodrum MM\nKonacık Mah. Gazderesi cad. No21-3 Bodrum/ Muğla Muğla Muğla 34000 EGE BÖLGE"
    },
    {
        "yapilandirilmis_veri": {
            "fatura_no": "PRT2024000003555",
            "fatura_tarihi": "14-09-2024",
            "duzenleme_saati": "00:00:01",
            "ettn": "fa68370a-bbba-4e29-a6c4-3699c6abc47c",
            "mal_hizmet_toplam_tutari": "206.140,00 TL",
            "para_birimi": "TL",
            "senaryo": "TICARIFATURA",
            "fatura_tipi_kod": "SATIS",
            "irsaliye_tarihi": "08-09-2024",
            "alici_vergi_dairesi": "BEYKOZ",
            "urun_kalemleri": []
        },
        "ham_metin": "PARILTIM END.TOPLU YEMEK HİZ.TUR.SAN.VE TİC.A.Ş.\nMuhasebe\nGÖZTEPE MAH. EKSEN SOK. NO:8/1 BEYKOZ/ İSTANBUL İstanbul\n34815 Beykoz/ İstanbul\nTel: 0216 465 96 66 Fax: 0216 465 97 17\nWeb Sitesi: www.pariltim-newrest.com\nE-Posta: muhasebe@pariltim-newrest.eu\nVergi Dairesi: BEYKOZ\nVKN: 9000068418\ne-FATURA\nTICARETSICILNO: 702892-0\nMERSISNO: 0721038111300018\nSAYIN\nSOA TOPLU YEMEK ÜRETİM VE SERVİS A.Ş. Özelleştirme No: TR1.2\nSOA TOPLU YEMEK ÜRETİM VE SERVİS A.Ş.\nSenaryo: TICARIFATURA\nÇaybaşı Mahallesi Aydın Caddesi No:51 35880 Torbalı İzmir\nFatura Tipi: SATIS\n35880 Torbalı / İZMİR\nFatura No: PRT2024000003555\nE-Posta: goktug.akishalioglu@soa.com.tr\nFatura Tarihi: 14-09-2024\nTel: 0530 763 15 49 Fax: 0530 763 15 49\nVergi Dairesi: KOZYATAĞI Düzenleme Tarihi: 14-09-2024\nVKN: 9000068418 Düzenleme Saati: 00:00:01\nİrsaliye Tarihi: 08-09-2024\nETTN: fa68370a-bbba-4e29-a6c4-3699c6abc47c\nSıra İskonto İskonto KDV\nMal Hizmet Miktar Birim Fiyat KDV Tutarı Diğer Vergiler Mal Hizmet Tutarı\nNo Oranı Tutarı Oranı\n1.245\n1 ÖĞLE YEMEĞİ-SOA YEMEK 92,00000000 TL %10,00 11.454,00 TL 114.540,00 TL\nAdet\nAKŞAM YEMEĞİ-SOA\n2 775 Adet 92,00000000 TL %10,00 7.130,00 TL 71.300,00 TL\nYEMEK\n3 SOA -POĞAÇA BEDELİ- 355 Adet 10,00000000 TL %10,00 355,00 TL 3.550,00 TL\nÇORBA BEDELİ-SOA\n4 355 Adet 10,00000000 TL %10,00 355,00 TL 3.550,00 TL\nYEMEK\nSICAK KUMANYA-SOA\n5 220 Adet 60,00000000 TL %10,00 1.320,00 TL 13.200,00 TL\nYEMEK\nMal Hizmet Toplam Tutarı 206.140,00 TL\nToplam İskonto 0,00 TL\nHesaplanan GERÇEK USÜLDE KATMA\n20.614,00 TL\nDEĞER VERGİSİ(%10)\nVergiler Dahil Toplam Tutar 226.754,00 TL\nÖdenecek Tutar 226.754,00 TL\n8-14.09 FATURASIDIR\niki yüz yirmi altı bin yedi yüz elli dört türk lirası\n#SEVKADRESI: SOA TOPLU YEMEK ÜRETİM VE SERVİS A.Ş. Çaybaşı Mahallesi Aydın Caddesi No:51 35880 Torbalı İzmir Torbalı 35880 İZMİR\n50.30.02 - İzmir MM\nKemalpaşa Osb. 18. Sok No:132 Kemalpaşa/ İzmir İzmir İzmir 34000 EGE BÖLGE"
    },
    {
        "yapilandirilmis_veri": {
            "fatura_no": "KPS2024000000054",
            "fatura_tarihi": "30-06-2024",
            "duzenleme_saati": "18:31:16",
            "ettn": "86e5232d-112d-4ada-b492-3363dbe1b333",
            "mal_hizmet_toplam_tutari": "1.392.574,24 TL",
            "para_birimi": "TL",
            "senaryo": "TICARIFATURA",
            "fatura_tipi_kod": "SATIS",
            "siparis_tarihi": "30-06-2024",
            "satici_unvan": "e-FATURA SAYIN TEST FRİMAS TEST ADRESI Özelleştirme No: TR1.2 No:1 Senaryo: TICARIFATURA Kapı No:1 Fatura Tipi: SATIS BARTIN/ BARTIN Fatura No: KPS2024000000054 E-Posta: Boş Fatura Tarihi: 30-06-2024 Tel: 05050000000 Fax: 05050000000 Vergi Dairesi: MERKEZ Düzenleme Tarihi: 30-06-2024 VKN: 9000068418 Düzenleme Saati: 18:31:16 Sipariş Tarihi: 30-06-2024 ETTN: 86e5232d-112d-4ada-b492-3363dbe1b333 Sıra İskonto İskonto KDV Mal Hizmet Miktar Birim Fiyat KDV Tutarı Diğer Vergiler Mal Hizmet Tutarı No Oranı Tutarı Oranı 1 ACI BİBER TANE 234 Adet 495,05000000 TL %1,00 1.158,42 TL 115.841,58 TL 2 ACI BİBER TANE 234 Adet 495,05000000 TL %1,00 1.158,42 TL 115.841,58 TL 2.345 3 ACI BİBER TANE 495,05000000 TL %1,00 11.608,92 TL 1.160.891,08 TL Adet Mal Hizmet Toplam Tutarı 1.392.574,24 TL Toplam İskonto 0,00 TL Hesaplanan KDV(%18) 13.925,76 TL Vergiler Dahil Toplam Tutar 1.406.500,00 TL Ödenecek Tutar 1.406.500,00 TL Kdv % : 18 Matrah : 18.00 Kdv Tutar : 663.56 Kdv % : 1 Matrah : 1.00 Kdv Tutar : 13925.76 Yazı İle : BİRMİLYONDÖRTYÜZALTIBİNBEŞYÜZ TÜRK LİRASI SIFIR KURUŞ. Kdv % : 18 Matrah : 18.00 Kdv Tutar : 663.56 Kdv % : 1 Matrah : 1.00 Kdv Tutar : 13925.76 Yazı İle : BİRMİLYONDÖRTYÜZALTIBİNBEŞYÜZ TÜRK LİRASI SIFIR KURUŞ.",
            "satici_adres": "I Özelleştirme No: TR1.2 No:1 Senaryo: TICARIFATURA Kapı No:1 Fatura Tipi: SATIS BARTIN/ BARTIN Fatura No: KPS2024000000054 E-Posta: Boş Fatura Tarihi: 30-06-2024",
            "alici_adres": "I Özelleştirme No: TR1.2 No:1 Senaryo: TICARIFATURA Kapı No:1 Fatura Tipi: SATIS BARTIN/ BARTIN Fatura No: KPS2024000000054 E-Posta: Boş Fatura Tarihi: 30-06-2024",
            "alici_vergi_dairesi": "Bartın",
            "urun_kalemleri": []
        },
        "ham_metin": "Kepsoft Yazılım\n1 No:1\nMERKEZ/ BARTIN\nVergi Dairesi: Bartın\nVKN: 9000068418\nMERSISNO: 1\nTICARETSICILNO: 1\ne-FATURA\nSAYIN\nTEST FRİMAS TEST ADRESI Özelleştirme No: TR1.2\nNo:1 Senaryo: TICARIFATURA\nKapı No:1\nFatura Tipi: SATIS\nBARTIN/ BARTIN\nFatura No: KPS2024000000054\nE-Posta: Boş\nFatura Tarihi: 30-06-2024\nTel: 05050000000 Fax: 05050000000\nVergi Dairesi: MERKEZ Düzenleme Tarihi: 30-06-2024\nVKN: 9000068418 Düzenleme Saati: 18:31:16\nSipariş Tarihi: 30-06-2024\nETTN: 86e5232d-112d-4ada-b492-3363dbe1b333\nSıra İskonto İskonto KDV\nMal Hizmet Miktar Birim Fiyat KDV Tutarı Diğer Vergiler Mal Hizmet Tutarı\nNo Oranı Tutarı Oranı\n1 ACI BİBER TANE 234 Adet 495,05000000 TL %1,00 1.158,42 TL 115.841,58 TL\n2 ACI BİBER TANE 234 Adet 495,05000000 TL %1,00 1.158,42 TL 115.841,58 TL\n2.345\n3 ACI BİBER TANE 495,05000000 TL %1,00 11.608,92 TL 1.160.891,08 TL\nAdet\nMal Hizmet Toplam Tutarı 1.392.574,24 TL\nToplam İskonto 0,00 TL\nHesaplanan KDV(%18) 13.925,76 TL\nVergiler Dahil Toplam Tutar 1.406.500,00 TL\nÖdenecek Tutar 1.406.500,00 TL\nKdv % : 18 Matrah : 18.00 Kdv Tutar : 663.56 Kdv % : 1 Matrah : 1.00 Kdv Tutar : 13925.76 Yazı İle : BİRMİLYONDÖRTYÜZALTIBİNBEŞYÜZ TÜRK LİRASI SIFIR\nKURUŞ.\nKdv % : 18 Matrah : 18.00 Kdv Tutar : 663.56 Kdv % : 1 Matrah : 1.00 Kdv Tutar : 13925.76 Yazı İle : BİRMİLYONDÖRTYÜZALTIBİNBEŞYÜZ TÜRK LİRASI SIFIR\nKURUŞ."
    },
    {
        "yapilandirilmis_veri": {
            "fatura_no": "PRT2024000003563",
            "fatura_tarihi": "14-09-2024",
            "duzenleme_saati": "00:00:01",
            "ettn": "d90b9219-bf00-4893-9bf2-fec6371e92b0",
            "mal_hizmet_toplam_tutari": "236.948,00 TL",
            "para_birimi": "TL",
            "senaryo": "TICARIFATURA",
            "fatura_tipi_kod": "SATIS",
            "irsaliye_tarihi": "08-09-2024",
            "alici_vergi_dairesi": "BEYKOZ",
            "urun_kalemleri": []
        },
        "ham_metin": "PARILTIM END.TOPLU YEMEK HİZ.TUR.SAN.VE TİC.A.Ş.\nMuhasebe\nGÖZTEPE MAH. EKSEN SOK. NO:8/1 BEYKOZ/ İSTANBUL İstanbul\n34815 Beykoz/ İstanbul\nTel: 0216 465 96 66 Fax: 0216 465 97 17\nWeb Sitesi: www.pariltim-newrest.com\nE-Posta: muhasebe@pariltim-newrest.eu\nVergi Dairesi: BEYKOZ\nVKN: 9000068418\ne-FATURA\nTICARETSICILNO: 702892-0\nMERSISNO: 0721038111300018\nSAYIN\nBEŞER BALATACILIK SAN.VE TİC.A.Ş. Özelleştirme No: TR1.2\nBEŞER BALATACILIK SAN.VE TİC.A.Ş.\nSenaryo: TICARIFATURA\nANKARA CAD. NO: 309\nFatura Tipi: SATIS\n35080 BORNOVA / İZMİR\nFatura No: PRT2024000003563\nE-Posta: mustafa.guler@beser.com.tr\nFatura Tarihi: 14-09-2024\nTel: 0530 425 97 53\nVergi Dairesi: BORNOVA Düzenleme Tarihi: 14-09-2024\nVKN: 9000068418 Düzenleme Saati: 00:00:01\nİrsaliye Tarihi: 08-09-2024\nETTN: d90b9219-bf00-4893-9bf2-fec6371e92b0\nSıra İskonto İskonto KDV\nMal Hizmet Miktar Birim Fiyat KDV Tutarı Diğer Vergiler Mal Hizmet Tutarı\nNo Oranı Tutarı Oranı\nKAHVALTI-BEŞER\n1 14 Adet 92,00000000 TL %10,00 128,80 TL 1.288,00 TL\nBALATACILIK-İZMİR MM\nÖĞLE YEMEĞİ-BEŞER 1.480\n2 92,00000000 TL %10,00 13.616,00 TL 136.160,00 TL\nBALATACILIK-İZMİR MM Adet\nAKŞAM YEMEĞİ-BEŞER\n3 400 Adet 92,00000000 TL %10,00 3.680,00 TL 36.800,00 TL\nBALATACILIK-İZMİR MM\nAYRAN-BEŞER 3.200\n4 11,00000000 TL %10,00 3.520,00 TL 35.200,00 TL\nBALATACILIK-İZMİR MM Adet\nSODA-BEŞER 2.500\n5 11,00000000 TL %10,00 2.750,00 TL 27.500,00 TL\nBALATACILIK-İZMİR MM Adet\nMal Hizmet Toplam Tutarı 236.948,00 TL\nToplam İskonto 0,00 TL\nHesaplanan GERÇEK USÜLDE KATMA\n23.694,80 TL\nDEĞER VERGİSİ(%10)\nVergiler Dahil Toplam Tutar 260.642,80 TL\nÖdenecek Tutar 260.642,80 TL\n8-14.09 FATURASI\niki yüz altmış bin altı yüz kırk iki türk lirası ve seksen kuruş\n#SEVKADRESI: BEŞER BALATACILIK SAN.VE TİC.A.Ş. ANKARA CAD. NO: 309 BORNOVA 35080 İZMİR\n50.30.02 - İzmir MM\nKemalpaşa Osb. 18. Sok No:132 Kemalpaşa/ İzmir İzmir İzmir 34000 EGE BÖLGE"
    },
    {
        "yapilandirilmis_veri": {
            "fatura_no": "YON2023341012345",
            "fatura_tarihi": "12-04-2023",
            "duzenleme_saati": "17:00:26",
            "ettn": "e2d0887e-1d6c-40fc-b2ca-9f1b1415db60",
            "siparis_no": "ORD1234567",
            "mal_hizmet_toplam_tutari": "169.514,77 TL",
            "para_birimi": "TL",
            "senaryo": "TICARIFATURA",
            "fatura_tipi_kod": "SATIS",
            "irsaliye_no": "ve",
            "siparis_tarihi": "02-05-2023",
            "satici_unvan": "-111 e-FATURA Özelleştirme No: TR1.2 SAYIN Senaryo: TICARIFATURA NERMİN Fatura Tipi: SATIS NERMİN ÖZER Fatura No: YON2023341012345 Web Sitesi: Web Sitesi Fatura Tarihi: 12-04-2023 E-Posta: test@test.com Düzenleme Tarihi: 12-04-2023 Tel: 0212200022 Fax: 22111222 Vergi Dairesi: B.MÜKELLEFLER Düzenleme Saati: 17:00:26 VKN: 9000068418 Sipariş No: ORD1234567 Sipariş Tarihi: 02-05-2023 ETTN: e2d0887e-1d6c-40fc-b2ca-9f1b1415db60 Sıra İskonto İskonto KDV Mal Hizmet Miktar Birim Fiyat KDV Tutarı Diğer Vergiler Mal Hizmet Tutarı No Oranı Tutarı Oranı 1 SAĞ SİS FAR BRAKETİ 1 Adet 552,90000000 TL 0,00 TL %18,00 49,76 TL 326,21 TL 1 ÖN PANEL 1 Adet 15.897,78000000 TL 0,00 TL %18,00 1.430,80 TL 9.379,69 TL 1 ÖN TAMPON DARBE EMİCİ 1 Adet 2.613,05000000 TL 0,00 TL %18,00 235,17 TL 1.541,70 TL RADYATÖR YEDEK SU 1 1 Adet 2.029,62000000 TL 0,00 TL %18,00 182,67 TL 1.197,48 TL DEPOSU 1 SİLECEK SU DEPOSU 1 Adet 4.120,14000000 TL 0,00 TL %18,00 370,81 TL 2.430,88 TL 1 SİLECEK SU DEPO BOĞAZI 1 Adet 731,49000000 TL 0,00 TL %18,00 65,83 TL 431,58 TL 1 CAM SU DEPO KAPAĞI 1 Adet 372,65000000 TL 0,00 TL %18,00 33,54 TL 219,86 TL 1 ÇAMURLUK DAVLUMBAZI 1 Adet 2.314,07000000 TL 0,00 TL %18,00 208,27 TL 1.365,30 TL TURBO RADYATÖRÜ 1 1 Adet 959,19000000 TL 0,00 TL %18,00 86,33 TL 565,92 TL BAĞLANTI SAĞ YEDEK SU BİDON 1 1 Adet 971,84000000 TL 0,00 TL %18,00 87,47 TL 573,39 TL HORTUMU MOTOR KAPUT 1 1 Adet 1.256,35000000 TL 0,00 TL %18,00 113,07 TL 741,25 TL MENTEŞESİ SAĞ 1 MOTOR KAPUTU 1 Adet 26.200,31000000 TL 0,00 TL %18,00 2.358,03 TL 15.458,18 TL 1 SAĞ ÇAMURLUK 1 Adet 8.078,41000000 TL 0,00 TL %18,00 727,06 TL 4.766,26 TL 1 SAĞ ÖN DODİK 1 Adet 3.235,85000000 TL 0,00 TL %18,00 291,23 TL 1.909,15 TL 1 SAĞ FAR 1 Adet 7.765,10000000 TL 0,00 TL %18,00 698,86 TL 4.581,41 TL 1 ÖN TAMPON 1 Adet 8.679,33000000 TL 0,00 TL %18,00 781,14 TL 5.120,80 TL 1 ÖN TAMPON SOL AYAKA 1 Adet 217,52000000 TL 0,00 TL %18,00 19,58 TL 128,34 TL 1 ÖN TAMPON SAĞ AYAK 1 Adet 217,52000000 TL 0,00 TL %18,00 19,58 TL 128,34 TL 1 SAĞ SİS FARI 1 Adet 2.859,29000000 TL 0,00 TL %18,00 257,34 TL 1.686,98 TL 1 SAĞ SİS FAR BRAKETİ 1 Adet 418,87000000 TL 0,00 TL %18,00 37,70 TL 247,13 TL RADYATÖR HAVA 1 1 Adet 1.352,41000000 TL 0,00 TL %18,00 121,72 TL 797,92 TL YÖNLENDİRİCİ SAĞ 1 215/60R17 96 H SNOW 1 Adet 2.400,00000000 TL 0,00 TL %18,00 432,00 TL 2.832,00 TL 1 SAĞ ÖN AMORTİSÖR 1 Adet 4.218,05000000 TL 0,00 TL %18,00 379,62 TL 2.488,65 TL 1 SAĞ ALT SALINCAK 1 Adet 5.317,25000000 TL 0,00 TL %18,00 478,55 TL 3.137,18 TL 1 SAĞ ÖN TAŞIYICI 1 Adet 9.035,06000000 TL 0,00 TL %18,00 813,16 TL 5.330,69 TL 1 ÖN PORYA 1 Adet 7.423,12000000 TL 0,00 TL %18,00 668,08 TL 4.379,64 TL 1 ROT BAŞI 1 Adet 1.746,33000000 TL 0,00 TL %18,00 157,17 TL 1.030,33 TL 1 SAĞ ASKI ROTU 1 Adet 969,03000000 TL 0,00 TL %18,00 87,21 TL 571,73 TL 1 AMORTİSÖR ÜST TAKOZU 1 Adet 1.255,53000000 TL 0,00 TL %18,00 113,00 TL 740,76 TL 1 ÖN TAMPON DEMİRİ 1 Adet 12.160,90000000 TL 0,00 TL %18,00 1.094,48 TL 7.174,93 TL ÖN TAMPON ALT İNCE 1 1 Adet 4.270,47000000 TL 0,00 TL %18,00 384,34 TL 2.519,58 TL DEMİR RADYATÖR HAVA 1 1 Adet 1.175,34000000 TL 0,00 TL %18,00 105,78 TL 693,45 TL YÖNLENDİRİCİ 1 GENEL ONARIM İŞÇİLİĞİ 354 Adet 50,00000000 TL 0,00 TL %18,00 2.867,40 TL 18.797,40 TL MOTOR TRAVERS , JANT 1 220 Adet 50,00000000 TL 0,00 TL %18,00 1.782,00 TL 11.682,00 TL VE AKİS TAMİR Mal Hizmet Toplam Tutarı 169.514,77 TL Toplam İskonto 72.077,38 TL Hesaplanan KDV(%18) 17.538,73 TL Vergiler Dahil Toplam Tutar 114.976,11 TL Ödenecek Tutar 114.976,11 TL İrsaliye No ve Tarihleri : IRS000000001 (02-05-2023) | IRS000000002 (02-05-2023) Bayi No: 112221 Test Not alanı 3",
            "alici_vergi_dairesi": "Esenler",
            "urun_kalemleri": []
        },
        "ham_metin": "Uyumsoft Bilgi Sistemleri ve Teknolojileri A.Ş.\nYTÜ Davutpaşa Kampüsü No:401\nEsenler/ İstanbul\nVergi Dairesi: Esenler\nVKN: 9000068418\nMERSISNO: 12345669111\nTICARETSICILNO: 12345669-111\ne-FATURA\nÖzelleştirme No: TR1.2\nSAYIN\nSenaryo: TICARIFATURA\nNERMİN\nFatura Tipi: SATIS\nNERMİN ÖZER\nFatura No: YON2023341012345\nWeb Sitesi: Web Sitesi\nFatura Tarihi: 12-04-2023\nE-Posta: test@test.com\nDüzenleme Tarihi: 12-04-2023\nTel: 0212200022 Fax: 22111222\nVergi Dairesi: B.MÜKELLEFLER Düzenleme Saati: 17:00:26\nVKN: 9000068418 Sipariş No: ORD1234567\nSipariş Tarihi: 02-05-2023\nETTN: e2d0887e-1d6c-40fc-b2ca-9f1b1415db60\nSıra İskonto İskonto KDV\nMal Hizmet Miktar Birim Fiyat KDV Tutarı Diğer Vergiler Mal Hizmet Tutarı\nNo Oranı Tutarı Oranı\n1 SAĞ SİS FAR BRAKETİ 1 Adet 552,90000000 TL 0,00 TL %18,00 49,76 TL 326,21 TL\n1 ÖN PANEL 1 Adet 15.897,78000000 TL 0,00 TL %18,00 1.430,80 TL 9.379,69 TL\n1 ÖN TAMPON DARBE EMİCİ 1 Adet 2.613,05000000 TL 0,00 TL %18,00 235,17 TL 1.541,70 TL\nRADYATÖR YEDEK SU\n1 1 Adet 2.029,62000000 TL 0,00 TL %18,00 182,67 TL 1.197,48 TL\nDEPOSU\n1 SİLECEK SU DEPOSU 1 Adet 4.120,14000000 TL 0,00 TL %18,00 370,81 TL 2.430,88 TL\n1 SİLECEK SU DEPO BOĞAZI 1 Adet 731,49000000 TL 0,00 TL %18,00 65,83 TL 431,58 TL\n1 CAM SU DEPO KAPAĞI 1 Adet 372,65000000 TL 0,00 TL %18,00 33,54 TL 219,86 TL\n1 ÇAMURLUK DAVLUMBAZI 1 Adet 2.314,07000000 TL 0,00 TL %18,00 208,27 TL 1.365,30 TL\nTURBO RADYATÖRÜ\n1 1 Adet 959,19000000 TL 0,00 TL %18,00 86,33 TL 565,92 TL\nBAĞLANTI SAĞ\nYEDEK SU BİDON\n1 1 Adet 971,84000000 TL 0,00 TL %18,00 87,47 TL 573,39 TL\nHORTUMU\nMOTOR KAPUT\n1 1 Adet 1.256,35000000 TL 0,00 TL %18,00 113,07 TL 741,25 TL\nMENTEŞESİ SAĞ\n1 MOTOR KAPUTU 1 Adet 26.200,31000000 TL 0,00 TL %18,00 2.358,03 TL 15.458,18 TL\n1 SAĞ ÇAMURLUK 1 Adet 8.078,41000000 TL 0,00 TL %18,00 727,06 TL 4.766,26 TL\n1 SAĞ ÖN DODİK 1 Adet 3.235,85000000 TL 0,00 TL %18,00 291,23 TL 1.909,15 TL\n1 SAĞ FAR 1 Adet 7.765,10000000 TL 0,00 TL %18,00 698,86 TL 4.581,41 TL\n1 ÖN TAMPON 1 Adet 8.679,33000000 TL 0,00 TL %18,00 781,14 TL 5.120,80 TL\n1 ÖN TAMPON SOL AYAKA 1 Adet 217,52000000 TL 0,00 TL %18,00 19,58 TL 128,34 TL\n1 ÖN TAMPON SAĞ AYAK 1 Adet 217,52000000 TL 0,00 TL %18,00 19,58 TL 128,34 TL\n1 SAĞ SİS FARI 1 Adet 2.859,29000000 TL 0,00 TL %18,00 257,34 TL 1.686,98 TL\n1 SAĞ SİS FAR BRAKETİ 1 Adet 418,87000000 TL 0,00 TL %18,00 37,70 TL 247,13 TL\nRADYATÖR HAVA\n1 1 Adet 1.352,41000000 TL 0,00 TL %18,00 121,72 TL 797,92 TL\nYÖNLENDİRİCİ SAĞ\n1 215/60R17 96 H SNOW 1 Adet 2.400,00000000 TL 0,00 TL %18,00 432,00 TL 2.832,00 TL\n1 SAĞ ÖN AMORTİSÖR 1 Adet 4.218,05000000 TL 0,00 TL %18,00 379,62 TL 2.488,65 TL\n1 SAĞ ALT SALINCAK 1 Adet 5.317,25000000 TL 0,00 TL %18,00 478,55 TL 3.137,18 TL\n1 SAĞ ÖN TAŞIYICI 1 Adet 9.035,06000000 TL 0,00 TL %18,00 813,16 TL 5.330,69 TL\n1 ÖN PORYA 1 Adet 7.423,12000000 TL 0,00 TL %18,00 668,08 TL 4.379,64 TL\n1 ROT BAŞI 1 Adet 1.746,33000000 TL 0,00 TL %18,00 157,17 TL 1.030,33 TL\n1 SAĞ ASKI ROTU 1 Adet 969,03000000 TL 0,00 TL %18,00 87,21 TL 571,73 TL\n1 AMORTİSÖR ÜST TAKOZU 1 Adet 1.255,53000000 TL 0,00 TL %18,00 113,00 TL 740,76 TL\n1 ÖN TAMPON DEMİRİ 1 Adet 12.160,90000000 TL 0,00 TL %18,00 1.094,48 TL 7.174,93 TL\nÖN TAMPON ALT İNCE\n1 1 Adet 4.270,47000000 TL 0,00 TL %18,00 384,34 TL 2.519,58 TL\nDEMİR\nRADYATÖR HAVA\n1 1 Adet 1.175,34000000 TL 0,00 TL %18,00 105,78 TL 693,45 TL\nYÖNLENDİRİCİ\n1 GENEL ONARIM İŞÇİLİĞİ 354 Adet 50,00000000 TL 0,00 TL %18,00 2.867,40 TL 18.797,40 TL\nMOTOR TRAVERS , JANT\n1 220 Adet 50,00000000 TL 0,00 TL %18,00 1.782,00 TL 11.682,00 TL\nVE AKİS TAMİR\nMal Hizmet Toplam Tutarı 169.514,77 TL\nToplam İskonto 72.077,38 TL\nHesaplanan KDV(%18) 17.538,73 TL\nVergiler Dahil Toplam Tutar 114.976,11 TL\nÖdenecek Tutar 114.976,11 TL\nİrsaliye No ve Tarihleri : IRS000000001 (02-05-2023) | IRS000000002 (02-05-2023)\nBayi No: 112221\nTest Not alanı 3"
    },
    {
        "yapilandirilmis_veri": {
            "fatura_no": "YON2023341012340",
            "fatura_tarihi": "12-04-2023",
            "duzenleme_saati": "17:00:26",
            "ettn": "938f126d-4642-43d0-ad47-b45b82d01d04",
            "siparis_no": "ORD1234567",
            "mal_hizmet_toplam_tutari": "169.514,77 TL",
            "para_birimi": "TL",
            "senaryo": "TICARIFATURA",
            "fatura_tipi_kod": "SATIS",
            "irsaliye_no": "ve",
            "siparis_tarihi": "09-05-2023",
            "satici_unvan": "-111 e-FATURA SAYIN Özelleştirme No: TR1.2 NERMİN Senaryo: TICARIFATURA NERMİN ÖZER Fatura Tipi: SATIS ATAKENT MH. ZÜBEYDE HN. CAD. NO:15/1 Fatura No: YON2023341012340 BAŞİSKELE/ KOCAELİ Fatura Tarihi: 12-04-2023 Web Sitesi: Web Sitesi Düzenleme Tarihi: 12-04-2023 E-Posta: test@test.com Tel: 0212200022 Fax: 22111222 Düzenleme Saati: 17:00:26 VKN: 9000068418 Sipariş No: ORD1234567 Sipariş Tarihi: 09-05-2023 ETTN: 938f126d-4642-43d0-ad47-b45b82d01d04 Sıra İskonto İskonto KDV Mal Hizmet Miktar Birim Fiyat KDV Tutarı Diğer Vergiler Mal Hizmet Tutarı No Oranı Tutarı Oranı 1 SAĞ SİS FAR BRAKETİ 1 Adet 552,90000000 TL 0,00 TL %18,00 49,76 TL 326,21 TL 1 ÖN PANEL 1 Adet 15.897,78000000 TL 0,00 TL %18,00 1.430,80 TL 9.379,69 TL 1 ÖN TAMPON DARBE EMİCİ 1 Adet 2.613,05000000 TL 0,00 TL %18,00 235,17 TL 1.541,70 TL RADYATÖR YEDEK SU 1 1 Adet 2.029,62000000 TL 0,00 TL %18,00 182,67 TL 1.197,48 TL DEPOSU 1 SİLECEK SU DEPOSU 1 Adet 4.120,14000000 TL 0,00 TL %18,00 370,81 TL 2.430,88 TL 1 SİLECEK SU DEPO BOĞAZI 1 Adet 731,49000000 TL 0,00 TL %18,00 65,83 TL 431,58 TL 1 CAM SU DEPO KAPAĞI 1 Adet 372,65000000 TL 0,00 TL %18,00 33,54 TL 219,86 TL 1 ÇAMURLUK DAVLUMBAZI 1 Adet 2.314,07000000 TL 0,00 TL %18,00 208,27 TL 1.365,30 TL TURBO RADYATÖRÜ 1 1 Adet 959,19000000 TL 0,00 TL %18,00 86,33 TL 565,92 TL BAĞLANTI SAĞ YEDEK SU BİDON 1 1 Adet 971,84000000 TL 0,00 TL %18,00 87,47 TL 573,39 TL HORTUMU MOTOR KAPUT 1 1 Adet 1.256,35000000 TL 0,00 TL %18,00 113,07 TL 741,25 TL MENTEŞESİ SAĞ 1 MOTOR KAPUTU 1 Adet 26.200,31000000 TL 0,00 TL %18,00 2.358,03 TL 15.458,18 TL 1 SAĞ ÇAMURLUK 1 Adet 8.078,41000000 TL 0,00 TL %18,00 727,06 TL 4.766,26 TL 1 SAĞ ÖN DODİK 1 Adet 3.235,85000000 TL 0,00 TL %18,00 291,23 TL 1.909,15 TL 1 SAĞ FAR 1 Adet 7.765,10000000 TL 0,00 TL %18,00 698,86 TL 4.581,41 TL 1 ÖN TAMPON 1 Adet 8.679,33000000 TL 0,00 TL %18,00 781,14 TL 5.120,80 TL 1 ÖN TAMPON SOL AYAKA 1 Adet 217,52000000 TL 0,00 TL %18,00 19,58 TL 128,34 TL 1 ÖN TAMPON SAĞ AYAK 1 Adet 217,52000000 TL 0,00 TL %18,00 19,58 TL 128,34 TL 1 SAĞ SİS FARI 1 Adet 2.859,29000000 TL 0,00 TL %18,00 257,34 TL 1.686,98 TL 1 SAĞ SİS FAR BRAKETİ 1 Adet 418,87000000 TL 0,00 TL %18,00 37,70 TL 247,13 TL RADYATÖR HAVA 1 1 Adet 1.352,41000000 TL 0,00 TL %18,00 121,72 TL 797,92 TL YÖNLENDİRİCİ SAĞ 1 215/60R17 96 H SNOW 1 Adet 2.400,00000000 TL 0,00 TL %18,00 432,00 TL 2.832,00 TL 1 SAĞ ÖN AMORTİSÖR 1 Adet 4.218,05000000 TL 0,00 TL %18,00 379,62 TL 2.488,65 TL 1 SAĞ ALT SALINCAK 1 Adet 5.317,25000000 TL 0,00 TL %18,00 478,55 TL 3.137,18 TL 1 SAĞ ÖN TAŞIYICI 1 Adet 9.035,06000000 TL 0,00 TL %18,00 813,16 TL 5.330,69 TL 1 ÖN PORYA 1 Adet 7.423,12000000 TL 0,00 TL %18,00 668,08 TL 4.379,64 TL 1 ROT BAŞI 1 Adet 1.746,33000000 TL 0,00 TL %18,00 157,17 TL 1.030,33 TL 1 SAĞ ASKI ROTU 1 Adet 969,03000000 TL 0,00 TL %18,00 87,21 TL 571,73 TL 1 AMORTİSÖR ÜST TAKOZU 1 Adet 1.255,53000000 TL 0,00 TL %18,00 113,00 TL 740,76 TL 1 ÖN TAMPON DEMİRİ 1 Adet 12.160,90000000 TL 0,00 TL %18,00 1.094,48 TL 7.174,93 TL ÖN TAMPON ALT İNCE 1 1 Adet 4.270,47000000 TL 0,00 TL %18,00 384,34 TL 2.519,58 TL DEMİR RADYATÖR HAVA 1 1 Adet 1.175,34000000 TL 0,00 TL %18,00 105,78 TL 693,45 TL YÖNLENDİRİCİ 1 GENEL ONARIM İŞÇİLİĞİ 354 Adet 50,00000000 TL 0,00 TL %18,00 2.867,40 TL 18.797,40 TL MOTOR TRAVERS , JANT 1 220 Adet 50,00000000 TL 0,00 TL %18,00 1.782,00 TL 11.682,00 TL VE AKİS TAMİR Mal Hizmet Toplam Tutarı 169.514,77 TL Toplam İskonto 72.077,38 TL Hesaplanan KDV(%18) 17.538,73 TL Vergiler Dahil Toplam Tutar 114.976,11 TL Ödenecek Tutar 114.976,11 TL İrsaliye No ve Tarihleri : IRS000000001 (09-05-2023) | IRS000000002 (09-05-2023) 41AR054 #YÜZONDÖRTBİNDOKUZYÜZYETMİŞALTITLONBİR'kuruş#",
            "alici_vergi_dairesi": "Esenler",
            "urun_kalemleri": []
        },
        "ham_metin": "Uyumsoft Bilgi Sistemleri ve Teknolojileri A.Ş.\nYTÜ Davutpaşa Kampüsü No:401\nEsenler/ İstanbul\nVergi Dairesi: Esenler\nVKN: 9000068418\nMERSISNO: 12345669111\nTICARETSICILNO: 12345669-111\ne-FATURA\nSAYIN Özelleştirme No: TR1.2\nNERMİN Senaryo: TICARIFATURA\nNERMİN ÖZER\nFatura Tipi: SATIS\nATAKENT MH. ZÜBEYDE HN. CAD. NO:15/1\nFatura No: YON2023341012340\nBAŞİSKELE/ KOCAELİ\nFatura Tarihi: 12-04-2023\nWeb Sitesi: Web Sitesi\nDüzenleme Tarihi: 12-04-2023\nE-Posta: test@test.com\nTel: 0212200022 Fax: 22111222 Düzenleme Saati: 17:00:26\nVKN: 9000068418 Sipariş No: ORD1234567\nSipariş Tarihi: 09-05-2023\nETTN: 938f126d-4642-43d0-ad47-b45b82d01d04\nSıra İskonto İskonto KDV\nMal Hizmet Miktar Birim Fiyat KDV Tutarı Diğer Vergiler Mal Hizmet Tutarı\nNo Oranı Tutarı Oranı\n1 SAĞ SİS FAR BRAKETİ 1 Adet 552,90000000 TL 0,00 TL %18,00 49,76 TL 326,21 TL\n1 ÖN PANEL 1 Adet 15.897,78000000 TL 0,00 TL %18,00 1.430,80 TL 9.379,69 TL\n1 ÖN TAMPON DARBE EMİCİ 1 Adet 2.613,05000000 TL 0,00 TL %18,00 235,17 TL 1.541,70 TL\nRADYATÖR YEDEK SU\n1 1 Adet 2.029,62000000 TL 0,00 TL %18,00 182,67 TL 1.197,48 TL\nDEPOSU\n1 SİLECEK SU DEPOSU 1 Adet 4.120,14000000 TL 0,00 TL %18,00 370,81 TL 2.430,88 TL\n1 SİLECEK SU DEPO BOĞAZI 1 Adet 731,49000000 TL 0,00 TL %18,00 65,83 TL 431,58 TL\n1 CAM SU DEPO KAPAĞI 1 Adet 372,65000000 TL 0,00 TL %18,00 33,54 TL 219,86 TL\n1 ÇAMURLUK DAVLUMBAZI 1 Adet 2.314,07000000 TL 0,00 TL %18,00 208,27 TL 1.365,30 TL\nTURBO RADYATÖRÜ\n1 1 Adet 959,19000000 TL 0,00 TL %18,00 86,33 TL 565,92 TL\nBAĞLANTI SAĞ\nYEDEK SU BİDON\n1 1 Adet 971,84000000 TL 0,00 TL %18,00 87,47 TL 573,39 TL\nHORTUMU\nMOTOR KAPUT\n1 1 Adet 1.256,35000000 TL 0,00 TL %18,00 113,07 TL 741,25 TL\nMENTEŞESİ SAĞ\n1 MOTOR KAPUTU 1 Adet 26.200,31000000 TL 0,00 TL %18,00 2.358,03 TL 15.458,18 TL\n1 SAĞ ÇAMURLUK 1 Adet 8.078,41000000 TL 0,00 TL %18,00 727,06 TL 4.766,26 TL\n1 SAĞ ÖN DODİK 1 Adet 3.235,85000000 TL 0,00 TL %18,00 291,23 TL 1.909,15 TL\n1 SAĞ FAR 1 Adet 7.765,10000000 TL 0,00 TL %18,00 698,86 TL 4.581,41 TL\n1 ÖN TAMPON 1 Adet 8.679,33000000 TL 0,00 TL %18,00 781,14 TL 5.120,80 TL\n1 ÖN TAMPON SOL AYAKA 1 Adet 217,52000000 TL 0,00 TL %18,00 19,58 TL 128,34 TL\n1 ÖN TAMPON SAĞ AYAK 1 Adet 217,52000000 TL 0,00 TL %18,00 19,58 TL 128,34 TL\n1 SAĞ SİS FARI 1 Adet 2.859,29000000 TL 0,00 TL %18,00 257,34 TL 1.686,98 TL\n1 SAĞ SİS FAR BRAKETİ 1 Adet 418,87000000 TL 0,00 TL %18,00 37,70 TL 247,13 TL\nRADYATÖR HAVA\n1 1 Adet 1.352,41000000 TL 0,00 TL %18,00 121,72 TL 797,92 TL\nYÖNLENDİRİCİ SAĞ\n1 215/60R17 96 H SNOW 1 Adet 2.400,00000000 TL 0,00 TL %18,00 432,00 TL 2.832,00 TL\n1 SAĞ ÖN AMORTİSÖR 1 Adet 4.218,05000000 TL 0,00 TL %18,00 379,62 TL 2.488,65 TL\n1 SAĞ ALT SALINCAK 1 Adet 5.317,25000000 TL 0,00 TL %18,00 478,55 TL 3.137,18 TL\n1 SAĞ ÖN TAŞIYICI 1 Adet 9.035,06000000 TL 0,00 TL %18,00 813,16 TL 5.330,69 TL\n1 ÖN PORYA 1 Adet 7.423,12000000 TL 0,00 TL %18,00 668,08 TL 4.379,64 TL\n1 ROT BAŞI 1 Adet 1.746,33000000 TL 0,00 TL %18,00 157,17 TL 1.030,33 TL\n1 SAĞ ASKI ROTU 1 Adet 969,03000000 TL 0,00 TL %18,00 87,21 TL 571,73 TL\n1 AMORTİSÖR ÜST TAKOZU 1 Adet 1.255,53000000 TL 0,00 TL %18,00 113,00 TL 740,76 TL\n1 ÖN TAMPON DEMİRİ 1 Adet 12.160,90000000 TL 0,00 TL %18,00 1.094,48 TL 7.174,93 TL\nÖN TAMPON ALT İNCE\n1 1 Adet 4.270,47000000 TL 0,00 TL %18,00 384,34 TL 2.519,58 TL\nDEMİR\nRADYATÖR HAVA\n1 1 Adet 1.175,34000000 TL 0,00 TL %18,00 105,78 TL 693,45 TL\nYÖNLENDİRİCİ\n1 GENEL ONARIM İŞÇİLİĞİ 354 Adet 50,00000000 TL 0,00 TL %18,00 2.867,40 TL 18.797,40 TL\nMOTOR TRAVERS , JANT\n1 220 Adet 50,00000000 TL 0,00 TL %18,00 1.782,00 TL 11.682,00 TL\nVE AKİS TAMİR\nMal Hizmet Toplam Tutarı 169.514,77 TL\nToplam İskonto 72.077,38 TL\nHesaplanan KDV(%18) 17.538,73 TL\nVergiler Dahil Toplam Tutar 114.976,11 TL\nÖdenecek Tutar 114.976,11 TL\nİrsaliye No ve Tarihleri : IRS000000001 (09-05-2023) | IRS000000002 (09-05-2023)\n41AR054\n#YÜZONDÖRTBİNDOKUZYÜZYETMİŞALTITLONBİR'kuruş#"
    },
    {
        "yapilandirilmis_veri": {
            "fatura_no": "GUR2023000015746",
            "fatura_tarihi": "29-08-2023",
            "ettn": "d433c9af-3ef1-4591-9baf-5817e1106de1",
            "odenecek_tutar": "26",
            "mal_hizmet_toplam_tutari": "86.978,00 TL",
            "yazi_ile_tutar": "#YÜZİKİBİNALTIYÜZOTUZDÖRT",
            "para_birimi": "TL",
            "senaryo": "TICARIFATURA",
            "fatura_tipi_kod": "SATIS",
            "alici_vergi_dairesi": "ESENLER",
            "urun_kalemleri": []
        },
        "ham_metin": "ACME LOGISTICS\nMERKEZ MAH. BULVAR CAD. NO:1\n11111 AFYON\nTel: 1111 Fax: 5555\nWeb Sitesi: www.ACME.com.tr\nE-Posta: fatura@ACME.com\nVergi Dairesi: ESENLER\nVKN: 9000068418 e-FATURA\nSAYIN\nTEST MÜŞTERİSİ\nDEFTERDAR MAH.OTAKÇILAR CADDESİ.FLATOFİS İSTANBUL İŞ Özelleştirme No: TR1.2\nMERK.K:3 N:83 K:4 NO:78 D:59/1\nSenaryo: TICARIFATURA\nEYÜP/ İSTANBUL\nFatura Tipi: SATIS\nTel: 90 212 467 0619\nVergi Dairesi: ESENLER Fatura No: GUR2023000015746\nVKN: 9000068418 Fatura Tarihi: 29-08-2023\nDüzenleme Tarihi: 29-08-2023\nETTN: d433c9af-3ef1-4591-9baf-5817e1106de1\nSıra İskonto İskonto KDV\nMal Hizmet Miktar Birim Fiyat KDV Tutarı Diğer Vergiler Mal Hizmet Tutarı\nNo Oranı Tutarı Oranı\n1 NAKLİYE BEDELİ 1 Adet 3.732,00000000 TL %18,00 671,76 TL 3.732,00 TL\n2 NAKLİYE BEDELİ 1 Adet 3.732,00000000 TL %18,00 671,76 TL 3.732,00 TL\n3 MESAİ ÜCRETİ 1 Adet 750,00000000 TL %18,00 135,00 TL 750,00 TL\n4 NAKLİYE BEDELİ 1 Adet 3.732,00000000 TL %18,00 671,76 TL 3.732,00 TL\n5 NAKLİYE BEDELİ 1 Adet 3.732,00000000 TL %18,00 671,76 TL 3.732,00 TL\n6 NAKLİYE BEDELİ 1 Adet 3.732,00000000 TL %18,00 671,76 TL 3.732,00 TL\n7 NAKLİYE BEDELİ 1 Adet 3.732,00000000 TL %18,00 671,76 TL 3.732,00 TL\nGÜMRÜK 2.İSKELE\n8 1 Adet 741,00000000 TL %18,00 133,38 TL 741,00 TL\nİŞLEMLERİ\n9 NAKLİYE BEDELİ 1 Adet 15.733,00000000 TL %18,00 2.831,94 TL 15.733,00 TL\n10 TEMİNAT BEDELİ 1 Adet 2.301,00000000 TL %18,00 414,18 TL 2.301,00 TL\n11 NAKLİYE BEDELİ 1 Adet 3.732,00000000 TL %18,00 671,76 TL 3.732,00 TL\n12 NAKLİYE BEDELİ 1 Adet 3.732,00000000 TL %18,00 671,76 TL 3.732,00 TL\n13 MESAİ ÜCRETİ 1 Adet 750,00000000 TL %18,00 135,00 TL 750,00 TL\nGÜMRÜK 2.İSKELE\n14 1 Adet 741,00000000 TL %18,00 133,38 TL 741,00 TL\nİŞLEMLERİ\n15 NAKLİYE BEDELİ 1 Adet 14.335,00000000 TL %18,00 2.580,30 TL 14.335,00 TL\n16 TEMİNAT BEDELİ 1 Adet 2.301,00000000 TL %18,00 414,18 TL 2.301,00 TL\n17 MESAİ ÜCRETİ 1 Adet 750,00000000 TL %18,00 135,00 TL 750,00 TL\n18 NAKLİYE BEDELİ 1 Adet 3.732,00000000 TL %18,00 671,76 TL 3.732,00 TL\n19 NAKLİYE BEDELİ 1 Adet 3.732,00000000 TL %18,00 671,76 TL 3.732,00 TL\nGÜMRÜK 2.İSKELE\n20 1 Adet 741,00000000 TL %18,00 133,38 TL 741,00 TL\nİŞLEMLERİ\n21 TEMİNAT BEDELİ 1 Adet 2.301,00000000 TL %18,00 414,18 TL 2.301,00 TL\n22 NAKLİYE BEDELİ 1 Adet 3.732,00000000 TL %18,00 671,76 TL 3.732,00 TL\n23 MESAİ ÜCRETİ 1 Adet 750,00000000 TL %18,00 135,00 TL 750,00 TL\n24 NAKLİYE BEDELİ 1 Adet 3.732,00000000 TL %18,00 671,76 TL 3.732,00 TL\nMal Hizmet Toplam Tutarı 86.978,00 TL\nToplam İskonto 0,00 TL\nHesaplanan KDV(%18.00) 15.656,04 TL\nVergiler Dahil Toplam Tutar 102.634,04 TL\nÖdenecek Tutar 102.634,04 TL\nYALNIZ #YÜZİKİBİNALTIYÜZOTUZDÖRTTÜRKLİRASIDÖRTKURUŞ#\n26 HAFTA PİYASA\nGENEL: İLGİLİ TAŞIMA ALT TEDARİKÇİMİZ (PİYASA ARAÇLARI ) TARAFINDAN YAPILMIŞTIR TEVKİFAT KANUNU KAPSAMI İÇERİSİNDE YER ALMAMAKTADIR.\n+\n01.07.2021 TARİHİ İTİBARİYLE TEVKİFATLI FATURA DÜZENLENEBİLMESİ İÇİN TOPLAM FATURA TUTARININ KDV DAHİL 2.000,00 TL VE ÜZERİNDE OLMASI\nGEREKMEKTEDİR."
    },
    {
        "yapilandirilmis_veri": {
            "fatura_no": "PRT2024000003357",
            "fatura_tarihi": "29-07-2024",
            "duzenleme_saati": "00:00:00",
            "ettn": "00a4f7c4-3122-491a-9372-d4ef39adfb34",
            "mal_hizmet_toplam_tutari": "147.666,00 TL",
            "para_birimi": "TL",
            "senaryo": "TICARIFATURA",
            "fatura_tipi_kod": "SATIS",
            "irsaliye_no": "ve",
            "alici_vergi_dairesi": "BEYKOZ",
            "urun_kalemleri": []
        },
        "ham_metin": "PARILTIM END.TOPLU YEMEK HİZ.TUR.SAN.VE TİC.A.Ş.\nGÖZTEPE MAH. EKSEN SOK. NO:8/1 ANADOLU HİSARI BEYKOZ/\nİSTANBUL İstanbul\n34815 İstanbul\nWeb Sitesi: www.pariltim-newrest.com\nVergi Dairesi: BEYKOZ\nVKN: 9000068418\nTICARETSICILNO: 702892-0\ne-FATURA\nMERSISNO: 0721038111300018\nSAYIN\nMNG KARGO YURTİÇİ VE YURTDIŞI TAŞ.A.Ş.\nMNG KARGO YURTİÇİ VE YURTDIŞI TAŞ.A.Ş.\nÖzelleştirme No: TR1.2\nAYAZAĞA MAH. CENDERE CAD. 1B APT. NO:109 B/5-6-7-8\nSenaryo: TICARIFATURA\n34396 SARIYER / İSTANBUL\nFatura Tipi: SATIS\nE-Posta: sakbulut@mngkargo.com.tr\nFatura No: PRT2024000003357\nTel: 0212 366 59 97 Fax: 0212 366 55 65\nVergi Dairesi: BÜYÜK MÜKELLEFLER Fatura Tarihi: 29-07-2024\nVKN: 9000068418 Düzenleme Tarihi: 29-07-2024\nDüzenleme Saati: 00:00:00\nETTN: 00a4f7c4-3122-491a-9372-d4ef39adfb34\nSıra İskonto İskonto KDV\nMal Hizmet Miktar Birim Fiyat KDV Tutarı Diğer Vergiler Mal Hizmet Tutarı\nNo Oranı Tutarı Oranı\nSANDVİÇ- MNG MARMARA\n1 10 Adet 48,00000000 TL %10,00 48,00 TL 480,00 TL\nBÖLGE\nÖĞLE YEMEĞİ-MNG GEBZE\n1 50 Adet 110,00000000 TL %10,00 550,00 TL 5.500,00 TL\nÖĞLEN YEMEĞİ\nAKŞAM YEMEĞİ-MNG\n1 102 Adet 110,00000000 TL %10,00 1.122,00 TL 11.220,00 TL\nGEBZE AKŞAM YEMEĞİ\n1 GECE YEMEĞİ- MNG GEBZE 96 Adet 110,00000000 TL %10,00 1.056,00 TL 10.560,00 TL\nSANDVİÇ-MNG GEBZE\n1 178 Adet 48,00000000 TL %10,00 854,40 TL 8.544,00 TL\nSANDVİÇ\nÖĞLE YEMEĞİ-MNG\n1 BAKIRKÖY TEKNİK ÖĞLEN 64 Adet 110,00000000 TL %10,00 704,00 TL 7.040,00 TL\nYEMEĞİ\nAKŞAM YEMEĞİ-MNG\n1 BAKIRKÖY TEKNİK AKŞAM 72 Adet 110,00000000 TL %10,00 792,00 TL 7.920,00 TL\nYEMEĞİ\nGECE YEMEĞİ-MNG\n1 BAKIRKÖY TEKNİK GECE 65 Adet 110,00000000 TL %10,00 715,00 TL 7.150,00 TL\nYEMEĞİ\nSANDVİÇ-MNG BAKIRKÖY\n1 163 Adet 48,00000000 TL %10,00 782,40 TL 7.824,00 TL\nTEKNİK SANDVİÇ\nEKMEK BEDELİ-MNG\n1 51 Adet 9,00000000 TL %10,00 45,90 TL 459,00 TL\nBAKIRKÖY\nÖĞLE YEMEĞİ-MNG\n1 İSTANBUL TEKNİK ÖĞLEN 47 Adet 110,00000000 TL %10,00 517,00 TL 5.170,00 TL\nYEMEĞİ\nAKŞAM YEMEĞİ-MNG\n1 İSTANBUL TEKNİK AKŞAM 63 Adet 110,00000000 TL %10,00 693,00 TL 6.930,00 TL\nYEMEĞİ\nGECE YEMEĞİ-MNG\n1 İSTANBUL TEKNİK GECE 64 Adet 110,00000000 TL %10,00 704,00 TL 7.040,00 TL\nYEMEĞİ\nÖĞLE YEMEĞİ-MNG\n1 İSTANBUL TEKNİK DİET 6 Adet 110,00000000 TL %10,00 66,00 TL 660,00 TL\nYEMEĞİ\nKUMANYA-GENEL-MNG\n1 İSTANBUL TEKNİK 15 Adet 88,00000000 TL %10,00 132,00 TL 1.320,00 TL\nKUMANYA\nSANDVİÇ-MNG İSTANBUL\n1 80 Adet 48,00000000 TL %10,00 384,00 TL 3.840,00 TL\nTEKNİK SANDVİÇ\nEKMEK BEDELİ-MNG\n1 98 Adet 9,00000000 TL %10,00 88,20 TL 882,00 TL\nİSTANBUL TEKNİK\nÖĞLE YEMEĞİ-MNG\n1 30 Adet 110,00000000 TL %10,00 330,00 TL 3.300,00 TL\nESENYURT ÖĞLEN YEMEĞİ\nAKŞAM YEMEĞİ-MNG\n1 75 Adet 110,00000000 TL %10,00 825,00 TL 8.250,00 TL\nESENYURT AKŞAM YEMEĞİ\nGECE YEMEĞİ-MNG\n1 86 Adet 110,00000000 TL %10,00 946,00 TL 9.460,00 TL\nESENYURT GECE YEMEĞİ\nSANDVİÇ BEDELİ-MNG\n1 181 Adet 48,00000000 TL %10,00 868,80 TL 8.688,00 TL\nESENYURT\nÖĞLE YEMEĞİ-MNG\n1 57 Adet 110,00000000 TL %10,00 627,00 TL 6.270,00 TL\nMARMARA ÖĞLEN YEMEĞİ\nAKŞAM YEMEĞİ-MNG\n1 60 Adet 110,00000000 TL %10,00 660,00 TL 6.600,00 TL\nMARMARA AKŞAM YEMEĞİ\nKUMANYA-GENEL-MNG\n1 20 Adet 88,00000000 TL %10,00 176,00 TL 1.760,00 TL\nMARMARA\nSANDVİÇ-MNG MARMARA\n1 55 Adet 48,00000000 TL %10,00 264,00 TL 2.640,00 TL\nSANDVİÇ\nEKMEK BEDELİ-MNG\n1 51 Adet 9,00000000 TL %10,00 45,90 TL 459,00 TL\nMARMARA AKTARMA\nGECE YEMEĞİ-MNG\n1 65 Adet 110,00000000 TL %10,00 715,00 TL 7.150,00 TL\nMARMARA\nGECE YEMEĞİ- MNG\n1 5 Adet 110,00000000 TL %10,00 55,00 TL 550,00 TL\nMARMARA BÖLGE\nMal Hizmet Toplam Tutarı 147.666,00 TL\nToplam İskonto 0,00 TL\nHesaplanan GERÇEK USÜLDE KATMA\n14.766,60 TL\nDEĞER VERGİSİ(%10)\nVergiler Dahil Toplam Tutar 162.432,60 TL\nÖdenecek Tutar 162.432,60 TL\nPDN2024000000536 (08-07-2024) | PDN2024000000537 (08-07-2024) | PDN2024000000605 (09-07-\n2024) | PDN2024000000606 (09-07-2024) | PDN2024000000607 (09-07-2024) | PDN2024000000608 (09-07-\nİrsaliye No ve Tarihleri :\n2024) | PDN2024000000609 (09-07-2024) | PDN2024000000610 (09-07-2024) | PDN2024000000611 (09-07-\n2024) | PDN2024000000612 (09-07-2024)\nÇoklu irsaliye testi MNG\nyüz altmış iki bin dört yüz otuz iki türk lirası ve altmış kuruş\n#SEVKADRESI: MNG KARGO YURTİÇİ VE YURTDIŞI TAŞ.A.Ş. AYAZAĞA MAH. CENDERE CAD. 1B APT. NO:109 B/5-6-7-8 SARIYER 34396 İSTANBUL\n50.10.01 - İkitelli MM\nSB Giyim Sanatkarlar Sanayyi Sitesi Deposite İş Merkezi Tesi Bloğu Zemin Kat No:Z-003 Başakşehir İkitelli/ İstanbul İstanbul 34000 İSTANBUL"
    }
]